Usuario,Fecha_Creación,Comentario
AnthonyThe6reat,2015-03-02,"Alright thats great, where did I say to not get the vaccine. I am literally just sharing my experience with it. Side effects exist, and if we shun and tell people they are lying when they try and speak up it benefits no one. Its a medical intervention, its not perfect. Do the grand majority of people have no issues, yes. Did I happen to be one of the unlucky few, yes. You can check my profile, I am not some bot that tries to spread misinformation. Literally one guy who unfortunately got injured and can just never talk about it. Me personally I wont be getting another vaccine, doesnt mean everyone should abstain. Thats up to each person and their doctor.

  
[https://www.cdc.gov/vaccine-safety/vaccines/covid-19.html](https://www.cdc.gov/vaccine-safety/vaccines/covid-19.html)"
SliC3dTuRd,2025-01-10,Long covid 😂😂
WinterWontStopComing,2019-01-27,Yes they do but not at the same rates.  And even when the flu causes neurological damage it isn’t comparable to dementia… come on
shiny1018,2021-12-07,It is worth being vaccinated against these risks.
[eliminado],,and mutations are also known as ... mutations.
FishermanNatural3986,2021-08-14,Whoa. Whoa. Don't bring John John into this! He didn't die to be compared to his absurd...cousin? (I know it's just a typo)
MadAstrid,2020-06-15,"RFK Jr., but I get your point."
tnderosa,2022-08-01,Then stay the fuck away from public you disease ridden host.
blurryface464,2021-08-05,The part where you say thousands of people died from the vaccine.
[eliminado],,[removed]
[eliminado],,[removed]
[eliminado],,[removed]
Apprehensive_Pilot43,2020-08-24,"That is a wrong figure, look up adenovirus vaccines"
[eliminado],,[removed]
[eliminado],,[removed]
Radiant_Bank_77879,2023-11-04,"Oh yes, this made up story that supposedly happened to all conservatives who didn’t get vaccinated, that you all repeat everywhere. We all totally believe you."
Apprehensive_Pilot43,2020-08-24,Lol
Apprehensive_Pilot43,2020-08-24,"Hmm the one treatment that was proven effective, and yet you still cling to what TV tells you

I got vaccinated."
Sloppykrab,2023-06-16,">Where is your medical degree from?

r/Facebookscience"
WaltChamberlin,2012-09-26,This is a weird cult that believes Covid is the end times and every infection dooms the person to death or permanent brain damage. You can see it on zerocovidcommunity. Very bizarre.
BanMeForBeingNice,2024-08-12,"So, the answer to my question, ""Got a credible source for this?"" is no."
ncolaros,2012-12-06,"Hey man, people think you should also get a flu shot every year. Not exactly a damning point."
Nikiaf,2012-04-26,"If we're being honest here, basically all developed countries in the world except the US."
adepressurisedcoat,2024-11-21,Probably not the USA. I still get boosters in Canada.
SnooStrawberries620,2020-08-25,Every other developed country on earth
Affectionate_Big8239,2022-05-01,I take them and so does my family.  And we don’t get Covid.  Just because YOU haven’t gotten them doesn’t mean that other people do not.
xstex-,2018-06-06,"Almost all old people take a combined flu and covid jab every year in the UK, which I imagine isn't much different to other countries."
Syndicalist_Vegan,2025-04-27,I did…you sure this isnt just you being a disease vector?
Blackarm777,2013-11-21,"My friends, family and I have all been up to date on boosters. Try not talking out of your ass for a day or two."
Syndicalist_Vegan,2025-04-27,Which is why you get the vaccine every winter…are you a bot?
5Hjsdnujhdfu8nubi,2022-08-30,Do people over 65 no longer matter?
Radiant_Bank_77879,2023-11-04,"Also repeating the lie that hospitals all over the world were reporting deaths as Covid when they weren’t, yet another Fox News lie. 

And, again we have to get the crayons and explained to right wingers, avoiding death wasn’t the only reason to get the vaccine. Getting the vaccine increase your immunity to it, so if you caught it, you would have lesser symptoms, thus it would be less easy to spread it to other people, in addition to the benefit of not getting as sick yourself.

Seriously, it’s like right wingers take pride and being uneducated and irrational."
Barbz182,2019-04-08,"Nobody was lied to. The majority of people isolated and vaccinated as they should have to prevent the spread of COVID and to reduce the load on hospitals as much as possible. Thankfully, not eveyone is selfish and ignorant enough as to ignore scientifically and medically based advice in order to help their fellow man."
SnooStrawberries620,2020-08-25,"Actually, as an occupational therapist, fall prevention, especially when a senior goes home from hospital, is one of the most important elements of discharge planning. Multiple professions are trained in this and use it really frequently."
BootyMcStuffins,2022-06-13,[Not any more](https://www.washingtonpost.com/health/2025/05/26/covid-vaccine-fda-restrictions-approval/)
diggerhistory,2016-05-13,Very big campaign as we head into winter. No great campaigns against. We tend to tell the anti-vacc crowd to get stuffed. I told one that few people will mourn their loss - FAFO..
diggerhistory,2016-05-13,Obviously misread it. That is what comes of turning 70.
Ill_Election_7610,2024-07-01,Funny how I’m downvoted for an objectively true fact
Anomalistics,2015-09-14,"You're probably engaging with a bot, dude. I think it's well established now that they're not as 'safe and effective' as they were made out to me. I know at least 2 people with severe complications as a result of having one. 

And for those that argue that having a shot was safer than experiencing the virus, well, my personal experience was a dribble from my nose for about 3 days. Most of the people that I know who have had the jab all regret having it. 

Remember that you're on Reddit, and it's mostly full of bots or people that are are happy to read the media and believe any story fed to them rather than doing their due diligence."
Better_Software2722,2023-09-20,You really are a sliced turd
EliteGamer11388,2015-10-24,"Yes, that's what people have been calling it. Why is it funny?"
SerOsisOfThuliver,2025-02-05,">that most people are mostly immune to 

>viruses mutate. get vaccinated

...that most people are mostly vaccinated against

...viruses mutate.  get immunized"
FenisDembo82,2022-09-08,"Yes,  a typo. John John did die but still has more functioning neurons than his cousin."
SituationNice7520,2025-02-22,No as in they're literally not being offered to healthy adults and children in the UK.
Educational-Side9940,2021-05-19,Wow. What a way to prove that you do not understand how science and medical research work at all. Especially when dealing with a new disease.
Agreeable-Camera-382,2024-07-14,"No, there isn't. You just listened to people like Joe Rogan and Facebook science and took off with it. Next time you get sick at all, just stay away from doctors. They have no credibility according to you."
Agreeable-Camera-382,2024-07-14,Never said that. You just did so you could say whatever rant you needed here. People like you need mental help. Grow up
CaptainAwesome06,2013-12-06,"According to VAERS (the self-reporting system), there is death rate of 0.0021% after taking the vaccine. That is undoubtedly higher than the actual rate since people can self-report and they'll report any death surrounding a vaccination. ie - Someone gets vaccinated and then 2 weeks later they die of something unrelated.

The global death rate from COVID is about 0.1% The US death rate is 0.4%, according to the CDC.

So you have a MUCH greater chance of dying from COVID than the vaccine."
Chonngau,2021-04-29,The risk of death and heart issues is way way higher for people with infection than people who get vaccinated.
MFrancisWrites,2020-05-18,"Respectfully, open mindedness is so important. But that means skepticism from all sides - open your mind too much and the brain topples out.

The side effects from the vaccine, when documented fully and measured properly, are incredibly mild when compared to the virus. Still. But at some point it became very fashionable to farm for clicks when anyone that died who may or may not have been vaccinated to peddle a narrative that never was on solid ground.

I don't think anyone should be forced, but I think those who buy into your thinking have been mislead, and that sucks."
ShyWombatFan,2024-07-17,"Funny story.   Measles vaccine… which basically had practically eradicated measles… works very well.  Not all vaccines are so good at stopping or strongly mitigating disease.  Covid vaccines are not perfect, never stated to be so.  Like flu vaccines… the goal is to mitigate severity so that the virus doesn’t kill. But keep on believing crap.  Get measles.  See how that works for you. (Assuming you are NOT vaccinated for measles)."
Agreeable-Camera-382,2024-07-14,"You understand some people can't get the covid vaccine,  right? So they depend on the people that can get to do so."
[eliminado],,[removed]
[eliminado],,[removed]
[eliminado],,[removed]
[eliminado],,[removed]
[eliminado],,[removed]
BanMeForBeingNice,2024-08-12,"I'll take them over antivax losers any time. Given that I have seen two people's minds get destroyed by it, I'm not totally shocked some are concerned."
BootyMcStuffins,2022-06-13,"I didn’t say you shouldn’t get a Covid shot. I’m just pointing out that people clutching their pearls over this 300/week number aren’t using their critical thinking skills.

300/week is a tiny number"
[eliminado],,[deleted]
AnthonyThe6reat,2015-03-02,"I know its usually this site where every moron thinks the vaccines are 100 percent perfect. It boggles my mind being injured and trying my absolute hardest to reason with them but they just will never hear it. I try and try to warn people and share my experience but it falls on deaf ears. I still share my story because I have every right to even if its means getting bad internet points lol. Hope your friends are doing okay, DM me if you want to hear what about any treatments they might want to try."
TisBeTheFuk,2018-05-01,I know / knew 4 people in my family who died from Covid. They were all unvaccinated. Two of them under 45 yo.
InformalYesterday760,2025-03-07,"The vaccines were absolutely shown to be safe


The likes of Joe Rogan have spread disinformation about it, but even their cited statistics turn out to be entirely backwards - the side effects they fear monger about are shown to be several times more likely to be found in someone recently infected with COVID than the vaccine. 

Ergo, the vaccines protected people against the same side effects people have tried to point to as examples for vaccines being dangerous."
FishermanNatural3986,2021-08-14,This is true
[eliminado],,[deleted]
[eliminado],,[removed]
[eliminado],,[removed]
[eliminado],,[removed]
[eliminado],,[removed]
Super_Skunk1,2021-01-31,No proof of that
chesterpower,2016-05-29,It’s not really an argument. It’s you making stuff up and a bunch of people calling you stupid.
[eliminado],,[removed]
[eliminado],,[removed]
WaltChamberlin,2012-09-26,Antivax losers and zerocovid losers are both suffering from very different types of brain rot. One thing I will say is that covid broke a ton of people's brains. Not directly because of the virus but because of the reaction to the virus.
eldonte,,What if it was shot up high school students? Does that still feel statistically insignificant? Lives matter.
diggerhistory,2016-05-13,The campaigns seek to remind people that it is safer to get the FREE vaccines - obviously reinforcing at no cost - and reminds them of the most at risk. Worked with me this year.
Educational-Side9940,2021-05-19,What do you consider an advertising campaign?  Because you are describing one and then saying it's not one.
Agreeable-Camera-382,2024-07-14,"So you're moving the goal posts to your out of scope rant? Sure. 

Yeah healthy people die. Very very very rare. Just like anything done in this field. So the fact you focus on such an outlier of a stat and think it's bigger than just selfish and stupid people not getting the vaccine is a mental block in you. Unless you have a lab and are an expert in this, maybe stop being a Dunning-Kruger"
CaptainAwesome06,2013-12-06,"A lot of ""healthy"" individuals fought for their lives during the height of COVID. I know this because my wife was treating them.

The biggest issue was that you didn't know what kind of case you were going to have. Sure, if you were young and healthy, you'd *probably* be fine. But why risk it when the vaccine was virtually harmless?

What we saw with VAERS was similar to what happens with autism. People get their 2-3 year old kids vaccinated and then all of a sudden their kid is unresponsive, etc. Did the vaccine give them autism? Of course not. That's just the age where autism gets diagnosed. Nobody is concerned when their 6 month old is non-verbal.

Correlation does not equal causation. The anti-vaccine crowd really struggles with this.

Also, 0.03% is still a lot higher than .0021%."
Chonngau,2021-04-29,"Think what you want. You are wrong. “The 18–45-y-o patients presented with pericarditis (2.2% vs. 0.5%, p = 0.003) and myocarditis (2.5% vs. 0.6%, p = 0.002) more frequently than patients >45 y/o.”

https://pmc.ncbi.nlm.nih.gov/articles/PMC8704739/"
MFrancisWrites,2020-05-18,"If you are healthy, the chances of adverse side effect are also that much lower from the vaccine. It looks like you have the ability to gather reasonable data - what percentage of vaccinated people in that healthy bracket are you seeing hit by serious side effects? More or less than what you've cited for the virus? If I recall, when I went looking, it was significantly smaller by a factor of 8-10. This hold up? And if so, why ""take"" a chance ten times higher than another? What line of thinking makes that the better outcome, once you remove yourself from inference and conspiracy?"
Agreeable-Camera-382,2024-07-14,"Yes, they would be that much safer. The data is out there to prove such a fact. You, however, are not an expect in this field and don't have a lab to prove your misinformation."
Agreeable-Camera-382,2024-07-14,Lots of proof. Simple Google
Agreeable-Camera-382,2024-07-14,Kinda like when you visit Minneapolis... Google it and  you'll find out.
[eliminado],,[removed]
[eliminado],,[removed]
[eliminado],,[deleted]
[eliminado],,[removed]
[eliminado],,[deleted]
[eliminado],,[removed]
Educational-Side9940,2021-05-19,There are lots of TV ads and website ads about getting the both the flu and COVID vaccine especially when the flu shot comes out and when a new COVID booster comes out. You maybe zone them out but they are there.
Agreeable-Camera-382,2024-07-14,I see your messages are being deleted. Wonder why...
Agreeable-Camera-382,2024-07-14,"It is if that's your reasoning for not getting a vaccine. 

Thousand huh? Out of how many given? Do the math on that. 

All caps huh? You're mentally unstable."
