Usuario,Fecha_Creación,Comentario
Psychotic_Breakdown,2023-06-24,Last year about 45 people from my work site called in sick all armt once. Covid still rips though once in a while
ShiningRayde,2010-01-27,"CBS News: [COVID variant NB.1.8.1 hits U.S. What to know about symptoms, new booster vaccine restrictions](https://www.cbsnews.com/news/covid-variant-nb-1-8-1-symptoms-booster-vaccine/)

This is after China has been public about this variant spreading and taking measures to secure against it, while the gutted CDC barely issued a memo about it being detected in the US."
mads_61,2019-12-15,"My mom’s best friend passed away from COVID just a few days ago. My friend’s wife is now (permanently?) disabled from long COVID. She had to quit her job as a surgeon because now she can only be awake for a few hours a day. She can no longer walk and has trouble speaking. I’d say COVID is still worth being cautious of. 

Not unlike the flu; most people who get it will be fine but others will die, and more will be disabled (I sustained lung damage from a bad bout of H1N1 I caught in high school). It’s worth exercising caution during flu season too."
dfinkelstein,2011-09-16,"People are less eager to watch news about it now, so there's less news about it. Private news networks broadcast whatever people are watching. If talking about COVID drives their viewers to switch channels, then they don't talk about it. It doesn't matter what the reality is. 
    
When reality suits their profits, then they talk about what's really going on. When it doesn't, then they talk about something else. You cannot watch private news stations and make some sort of inference about what must be happening based on what what they are or are not talking about.
    
If the station was being attacked by terrorists, but viewers kept tuning out when they brought it up, the they'd stop bringing it up, and you'd only find out when they entered the camera frame."
punkindle,2021-01-08,"I work in healthcare. It goes up and down about twice a year. Currently it's low, likely to go up again.

We had a big wave last summer. A smaller wave around Christmas.

As a country, we should have spent some money improving the ventilation systems of public buildings and transportation. Did you know if a plane is just sitting on the tarmac they switch off the ventilation systems? I wouldn't go on an airplane without a high quality N95 mask."
GlitteryStranger,2022-01-03,"It’s still there, a friend lost a family member a few weeks ago."
forogtten_taco,2021-10-14,Had covid last week.  Was 3 days of feeling like I got hit by a truck.  The. 7 days of EVERYTHING SMELLING LIKE ROTTING MEAT.   Would not recommend.   Dr said current strain you feel like shit for 2ish days then mild symptoms for a week.
BookLuvr7,2021-09-05,"My in-laws have had it for several weeks and are still exhausted and miserable. Like always, it depends on the person.

It killed my mom, so it pisses me off when people make light of it."
[eliminado],,"I had it a few weeks ago. Extremely mild symptoms. I didn't want to spread it so I stayed home until I was negative (5 days).

Immune-compromised people are still vulnerable to it."
[eliminado],,"I work in a hospital, people are still dying from COVID."
OldBanjoFrog,2017-05-29,"Last time I caught it (last year around Mardi Gras), I was knocked down for at least a week.  I thought I was dying."
aguer056,2023-02-23,"I was healthy, young and an athlete. I got COVID and developed long COVID. I am now quite disabled with debilitating symptoms of chronic fatigue, POTS, and MCAS"
OrneryZombie1983,2024-02-05,"""Why are more than 300 people in the US still dying from COVID every week?""

[https://abcnews.go.com/Health/300-people-us-dying-covid-week/story?id=122068959](https://abcnews.go.com/Health/300-people-us-dying-covid-week/story?id=122068959)"
Mysterious-Actuary65,2020-12-20,"It whooped my ass for three weeks last December. I'm vaccinated, and I still could only lay in bed, unable to move and running a dangerously high fever for weeks. That would have been the end of me, I'm almost positive, if not for the miracles of modern medicine. 

It's not gone. They are just ignoring it."
Affectionate_Big8239,2022-05-01,"Like any illness with a vaccine that’s available, it has become way less of an issue because people now have some level of immunity from vaccines or infection.  People still get sick & die, but in way fewer numbers due to the vaccines."
DoGood69,2025-01-10,"Where do you live and what news do you follow that has told you that Covid is nothing to worry about? It is absolutely still impacting people, especially those with other vulnerabilities."
purplehorseneigh,2023-03-04,Covid is still going around. I have a friend who is the only person at home right now that isn’t sick.  But she has to isolate and not do anything anyway otherwise she could get it and also spread it
Relevant-Package-928,2020-12-16,"I had it almost a year ago and still can't smell or taste anything right. My husband brought it home from an overseas flight so he got a huge viral load and was really, really sick. It took him several months to recover."
AStupidFuckingHorse,2023-12-27,A good family friend just died from it a few months ago. Alone in her home. And no one told me.
Pokabrows,2015-06-01,"Nah it's still a problem. People just got bored of being safe. I super recommend learding about long covid. There's a lot of long term chronic diseases people are getting due to damage from covid. 



I was so bad off from long covid last year I had to use either a cane (or a wheelchair for longer distances) for a while. Still on medication because my nervous system/ circulation is messed up but I'm able to go on proper walks again now so am able to slowly work on my stamina again. I mask everywhere because if I get sick again I could end up right back where I was and might not be as lucky in recovery next time."
Skiamakhos,2010-03-15,"The availability of vaccines tends to mean it's not such a big deal now. My mum was afraid to take the vaccine so when she had a fall & went into hospital for a dislocated metatarsal bone (lisfranc injury) & had to wait a week to be seen, she caught COVID while there. Her lungs failed. They put her on 7l/h of O2, then 14, but her lungs were a mess of blood clots and she died. This was after lockdown had finished & they weren't making a big fuss about COVID, but fully half the staff in that hospital were sick with COVID and off work. I've had all my shots & I haven't had COVID yet, but plenty of my friends have. It's like a bad 'flu, so they say, but if you're lucky that's it. 

That said... Long COVID is definitely a thing. Complications are definitely a thing. One of my friends is now on kidney dialysis 3x a week because of it. His kidneys got blood clots in them & failed. Another has had multiple strokes & finds it hard to work in his old role as a software developer. There is a significant risk of disability with this. Even with the vaccine, you've got a good chance of surviving but ending up with some debilitating disability.

They're not even counting the casualties these days though. If you can get your shots, take 'em. If you have it, stay indoors if you can, mask up if you have to go out. It hasn't gone anywhere, but the people in charge reckon profit is more important than people."
Conscious-Reserve-48,2023-06-02,An average of 350 Americans have been dying each week from COVID but it’s mostly people over 75 so no one cares.
tnderosa,2022-08-01,"Latest thing I read is another variant is starting to show in US. It is something to worry about bc even if you’ve had covid before, another infection can still cause long covid and with every infection, it actually affects your brain. We do not know yet the long term effects of covid but there are studies that suggest it does have some long term impacts"
Casanova2229,2020-10-05,She’s still around. Media doesn’t talk about it much.
doggofurever,2022-10-04,I just lost an honorary family member to Covid on the 24th. It's unfortunately still around. 💔
KronusIV,2018-01-11,"Covid is still responsible for .4% of deaths in the US. Not as bad as it was, but not nothing.

[https://covid.cdc.gov/covid-data-tracker/#datatracker-home](https://covid.cdc.gov/covid-data-tracker/#datatracker-home)"
Ishitinatuba,2013-01-05,"Its not one virus... there are numerous strains and as such, a case might be mild, another fuck a  family of athletes.

Still around."
InformalYesterday760,2025-03-07,"We have vaccines to help protect, but not perfectly of course, the most vulnerable. 

For me, COVID caused an autoimmune response that almost killed me. 

So largely people have ""moved on"", though my heart breaks for those with long COVID or similar complications. The world has largely move on, but some of them had their life forever altered by a roll of the cosmic dice and our inability to contain it earlier and prevent the spread before vaccines existed. 

I'm just lucky I avoided worse long term symptoms"
Comprehensive_Toe113,2021-08-27,"I heard somewhere that there's a breakout in Thailand.

https://www.nationthailand.com/blogs/health-wellness/40050276

So no it's not gone."
magic_crouton,2018-09-30,Its still here along with a ton of other viruses it's endemic.  And it will continue to kill and disable some people. I dont understand why in rhe US we are so averse to helping not spread germs and people are out sick across the board coughing and spreading their germs all over everyone instead of just showing a minimal amount of consideration and tossing a mask on and washing their hands.
Famous_Fondant_4107,2020-10-16,"Covid is still a problem and it’s still a pandemic. It was declared “over” for political reasons, not scientific. 

It’s not mild now. It is still killing people. Millions of people worldwide have and are continuing to get Long Covid. There is no cure. 

The vaccines don’t prevent transmission and they don’t prevent Long Covid. *Up to date* covid vaccines can help prevent severe acute illness and hospitalization. 

There are over 400,000 studies showing how covid damages our bodies. It’s a vascular illness and can impact every system and organ in our bodies including the brain. 

Wearing a well fitting KN95, KF94, N95, FFP2, FFP3, CAN99, or P100 mask does a great deal to protect people from Covid because it is airborne. Airborne means it is produced simply by breathing, even by people with no symptoms, and lingers/moves in the air like smoke. Opening windows and running air purifiers helps as well but nothing can replace the efficacy of a well fitting respirator mask. 

Stay safe! 😷❤️"
Ok-Negotiation-3892,2022-02-19,Still kills 350 people a week in the USA.
BY-750,2022-04-12,Go check covidlonghaulers subreddit and you will know more
DykeOuterHeaven,2025-04-14,"Well it hasnt been long enough to know all the symptoms of long covid. I still mask up, best case scenario it protects me from needing to be shut in my room for a week or so with absolutely nothing to do, worst case scenario it weakens my immune system even more among whatever else it could be doing 

Please mask up yall"
saveyboy,2018-12-05,It’s still out there. It’s not going away.
Ok-Tooth-4306,2024-01-20,"I managed to avoid it until last August. I’m assuming I got it from my nephew’s wedding as he tested positive and his dad (who doesn’t believe in testing 🙄) had symptoms. I have all my vaccines and mine was pretty mild. Felt like a sinus infection, but when I spiked a fever I knew it was something else. My symptoms lasted 3 days I think and by day 7 my new test came back negative. It still is going around but certain people will make you think it’s not or that everyone reacts the same way to it. My husband had it in 2020 and he was down for almost 10 days. He’s never been sicker in his life."
BanMeForBeingNice,2024-08-12,"\> Are we immune to it now?

No we are not at all. It's still spreading, and still kills around 300 people a day. What's particularly nasty about it is that it can sicken people for a long time, and it affects more than the respiratory system."
Life-Hearing-3872,,"Oh no, it's still around and we'll likely have new strains yearly. Since the vaccines are manufacturable now there's not quarantine issues. But it's a permanent part of life now."
phillygirllovesbagel,2021-06-15,"If you read the news, you'll find that approximately 300 people are still dying every week. Covid is still with us and will be for a long time. It's changing and evolving."
Calm-Maintenance-878,2021-01-27,"We are not fully immune, 300ish people a week die from it in America. Like a common cold, there won’t be a full immunity ever. There are many more things that kill over 300 a week so that also helps the public perception dissipate regarding it."
Several_Bee_1625,2025-03-24,"It's still around. The vast majority of people have some level of immunity to it due to vaccination and/or previous infections. So it's not as deadly, in general, for most people.

But immunity wanes and viruses mutate. So there will probably be surges every so often, like there are with the flu, some more serious than others.

Unfortunately, Trump is cutting programs meant to monitor the virus (and other public health threats) and stay prepared for it."
CraftFamiliar5243,2024-03-28,Some people are still dying from it.
MarshmallowReads,2023-11-03,It got boring so people moved on in general. That doesn’t mean it’s gone.
answers2linda,2023-12-29,"It’s like flu, measles, diphtheria, or pneumonia: it could kill you. Thank God we have vaccines."
t-o-m-u-s-a,2022-01-03,Three people in family have it and cannot shake the cough
Numerous-Abrocoma-50,2021-01-08,Historically viruses mutate to become both more transmissable and less lethal. Essentially they become another virus.
WanderingArtist_77,,"A new strain just popped up. NB.1.8.1. So, it's still out there, running rampant."
Relatively_happy,2024-05-12,"Im on a mine site at the moment and a old bloke tested positive, he has been quarantined to his room to not spread it. 

Is he fine, he was crook enough to get tested, but will he be fine, likely, and the 2 other people that catch it likely also fine, but theres a chance that someone might not be fine, and so thats why they do it"
[eliminado],,There are literally milions of people worldwide currently experiencing long covid/cfs due to the virus itself or the vaccine and some of their lives are completely ruined.
onestopunder,2018-05-24,"About 300 people die in the US every week (as of May 2025). So yeah, still serious and you should stay vaccinated and protect those who cannot be vaccinated or are at an elevated risk profile. (Source: https://www.wsj.com/health/healthcare/covid-19-low-activity-summer-rise-a8de51b8)"
gothicuhcuh,2023-12-14,I had Covid back in January. Not immune.
generic_redditor_71,2025-05-02,"It's now one of hundreds of endemic viral diseases that are everywhere, that most people are mostly immune to, but which occasionally make someone unlucky or vulnerable sick, just like flus and colds."
Wise-Field-7353,2024-07-17,"It's still circulating, and we're waiting on a summer wave of the new variant to hit. Now that almost everyone has had some exposure, dying of it is less common but still possible. 


Every infection is a dice roll in terms of severity, and your chance of long covid increases with each infection. By your forth infection, you're more likely to have long covid symptoms than not.


The best way to protect yourself is to wear an N95 in public spaces, and get your boosters."
CaptainAwesome06,2013-12-06,"People are still vulnerable to it, such as immunocompromised people (including old people). The vaccines help keep people out of the hospital. For the people who couldn't get vaccinated (or refused to), a lot of them already died. People who claim it's just a cold have survivorship bias."
EveryAccount7729,2025-04-17,"The latest strain is NB.1.8.1 and apparently it is causing worse health outcomes than some of the previous milder strains. 

you may be encouraged to get another booster soon as this is just coming to the USA now."
darklogic85,2019-09-09,"It's a combination of things. People have partial immunity to it now, due to people contracting it, and due to vaccines. Also, the virus has mutated over time, so the variants spreading now, are less dangerous than the variants at the beginning of the pandemic. It's a natural process for a lot of viruses and bacteria to mutate in a way that boosts their own rate of survival. It typically isn't beneficial to the virus or bacteria to kill its own host, so the more successful variants of a virus are the ones where the host lives the longest, or doesn't die at all, to give the virus the best chance of spreading to another host. That partially explains the variants that are common now.

We might see case numbers rise in the US in the next couple years though, if covid boosters are no longer available to people every fall as they have been the last few years."
FenisDembo82,2022-09-08,"The federal government has decided that only people with certain risk factors or who are over the age of 65 are not to be given Covid vaccines and boosters anymore,  so expect it to become more of a problem as new variants emerge."
Hour_Insurance_7795,2020-09-08,"It's still around, it's just not huge news that drives clicks anymore, so the media has largely moved on (despite what they claim, the media is in the business of generating views more than disseminating information)..  

Like any other flu bug, it can be potentially dangerous flu bug that will always exist and that we need to take precautions for on a perennial basis. That hasn't changed."
Deathcommand,2011-11-30,It's not fun in the news anymore. It's still very much an issue.
oscarismyfavorite,2024-04-01,It's always going around here
HistoricalString2350,2023-09-27,There’s a new strain starting in China. It will now be another seasonal thing in the fall winter like the flu and RSV every year. It might get really bad again with the cuts to vaccines for people only over 65.
kayae_,2022-02-15,"It can still be dangerous to the vulnerable ones, just like the flu. It can also come with post illness problems. I get vaccinated once a year and still wear a mask on public transport - my family member is post transplant and I try not to give them anything, not to mention covid or flu.
I wish more people took illnesses seriously after the pandemic. What is a runny nose to you can land someone in the hospital"
DanDanDan0123,2019-05-06,Just saw an article that said 300 a week die from COVID.
bacon-is-sexy,2013-08-18,300 people are dying from it every week in the US.
TappyMauvendaise,2019-07-09,Vaccines
incomplet-31,2025-05-22,300 people a week are still dying from it in the US.
Chesterfieldraven,2018-08-01,Vaccines baby
The_Wee-Donkey,2025-05-02,"It was a big deal because our healthcare systems couldn't cope with the number of severe cases, not because of the disease itself. When it first hit, it was spreading exponentially, and a sizeable number of those cases spent weeks in the hospital preventing the treatment of patients with other illnesses and conditions. 

The idea of socially isolating was to try and slow the spread of the disease, not to stop it altogether. If we could slow down the spread, we could delay people getting sick and therefore spread out the severe cases and give the hospitals a fighting chance to help care for all in need and not just the first ones through the door. Basically, instead of having x number of cases a week, it would be x number of cases a month, giving patients access to the resources . Of course, part of it was to protect the most vulnerable in our society by keeping the disease away from them where possible. 

Now, since the vaccine, the number of severe cases has reduced drastically. This is how vaccines work. They provide your own body with the tools it needs to fight off the infection, which greatly reduces the harsher symptoms. Now for most people a case of covid is like a cold/flu and while it might knock you on your ass, it is less likely to see you end up in hospital, meaning we don't need to keep socially isolated. 

However, like the flu, it can have bad years where the strain going around can be particularly nasty, giving rise to severe cases and may overwhelm hospitals again. We've thankfully not had a year where we've had to socially isolate again because flu is on the rise but you might hear doctors request people to get the vaccine to again slow spread and reduce case numbers."
MissHuLi,2024-10-27,Wasn't everyone saying that at some point it's something we'll just have to live with?
thebrokedown,2013-12-30,300 Americans still dying every week. We’ve decided to find it unimportant
Rare_Competition20,2024-05-12,"[https://www.youtube.com/watch?v=q0l4hl2xXBQ](https://www.youtube.com/watch?v=q0l4hl2xXBQ)  
[https://www.cbsnews.com/news/covid-variant-nb-1-8-1-symptoms-booster-vaccine/](https://www.cbsnews.com/news/covid-variant-nb-1-8-1-symptoms-booster-vaccine/)"
Emezlee,2025-04-14,Its in a much more manageable form. Don't think for one second that covid is completely gone is going to a disease similar to the flu
Aldo-Raine0,2023-06-10,"About 300 people a week are still dying from COVID in the US. The CDC has been purposefully gutted, do you’re just not hearing about it."
PoopMobile9000,2019-06-17,"As expected, it went from pandemic to endemic.

The pandemic was the virus’s mad rush across a population with no immunity. The moment Covid-19 arrived and spread a little, it became a certainty that basically everyone on earth would eventually gain antibodies—either through a vaccine or getting sick.

Now everyone on earth *has* gained those antibodies, through vaccine or illness or both. Like all viruses it continues to mutate and our immunity fades.  But even though the virus is still around, but it’s not making people as sick (because we all have prior immunity) and we’re not getting it all at once (because it’s spreading more slowly and less effectively).

It’s now just one of many diseases you can get, a bit worse than the common cold or flu, and still killing people who are old or immunocompromised, or just very unlucky."
LookinAtTheFjord,2024-04-26,Everyone with a brain in their head got the vaccine.
[eliminado],,For the most part it's basically another flu at this point
Glindanorth,2020-10-17,It's still here and killing [300 people a day](https://abcnews.go.com/amp/Health/300-people-us-dying-covid-week/story?id=122068959).
Elebenteen_17,2024-11-22,There is a new strain but… it’s just not as bad as it was when it started. They told us it would mutate and weaken and it did.
FluffyProphet,2016-06-14,"A few things.

Vaccinations reduced the spread and made it so most people who get it, don’t get it as bad.

Enough people have had it that they have built up some resistance. Further reducing the spread and severity.

The virus itself mutated to be more mild but more transmissible. Still dangerous to people with underlying conditions, but much like the flu, the majority of people will be able to shrug it off after a week of life sucking. There are still greater long term risks if you contract covid (long covid), but for the majority of people, it is a less severe virus than in 2020.

Finally, it’s now factored into our normal expectations of disease rates. So culturally, we are more numb to it."
shebabbleslikeaidiot,2011-10-04,It’s still a thing. I had it a month ago. I just stayed away from people for a little bit and then went about my life.
NoiseyTurbulence,2020-02-26,"It’s still around. It’s just that the vaccines have been administered to enough people that you’re not seeing it in the numbers you were before. It’s also closer to summer where you see a little bit less of it until fall comes back around when people are indoors more often.

A lot of people have opted for just adding it as a normal booster every year when they get their flu vaccine."
SnoozyRelaxer,2023-05-16,"I think its like any other flu now, been for a while.   
Still good to: Stay home if your sick so you don't give it to others."
Alaska1111,2021-05-19,Less of a problem. Bottom line is when people are sick regardless of what it is. Stay tf home and don’t spread it around
OptimusPhillip,2014-03-09,"The virus is now considered endemic to the human population, which basically means that it's transmitted among humans at a predictable, stable rate. Between that and the fact that a lot of people are now vaccinated against it, it's now far easier for our current health infrastructure to manage. People still catch it, and the symptoms aren't any less severe as they would've been during the pandemic, but major outbreaks are largely a thing of the past, and new cases are far easier to treat."
That_Damn_Samsquatch,2020-11-10,"Not 100% iimmune, but your body has seen it at this point. So the symptoms arent as intense. I know a few people who have had it in the past year. 
There is currently a new strain ramping up across Asia and Europe and has been found in the States. Its apparently pretty nasty."
Kelome001,2023-03-05,"I mean i had covid earlier this month. Was pretty mild. I had the first two rounds of shots, but I’ve still had it at least three times. Probably different strains or its wearing off. Its still a problem, just not same level as few years ago."
Realistic-Dog-7785,2025-04-30,"We are still getting new variants, it won’t be as worrisome until there’s a dangerous variant, just like the flu."
BojukaBob,2020-07-14,"People are still getting it, some people are still dying from it, but the media got bored reporting on it years ago. It's gone from pandemic to endemic and will just be a part of life from now on just like the flu did after the Spanish Flu epidemic."
[eliminado],,[removed]
