Usuario,Fecha_Creación,Comentario
billthedog0082,2019-01-12,"https://www.cdc.gov/cfa-modeling-and-forecasting/rt-estimates/index.html#:\~:text=COVID-19%20Influenza-,COVID-19,not%20changing%20in%2021%20states.

  
COVID is still around, along with the common cold, and the flu.  We were all cautioned towards the end of the pandemic that we would now have to learn to live with it."
weary_bee479,2022-02-02,"It’s like the flu, or pneumonia. People are still dying from it but it’s not on the news daily so you’re not paying attention to it anymore. 

There is also a vaccine now. It’s just like any epidemic, think AIDS, polio, Spanish flu. 

Now we’re back to measles because people are not vaccinating their kids."
reedshipper,2024-10-23,"Like a lot of people said, the vaccine has given a lot of people some type of immunity and it has become another endemic virus that we just have to deal with.

However, we are still left dealing with the ramifications of what the virus brought onto our society. Rapid inflation, higher costs on everything, much more advertising, people are lazier, stores are open fewer hours, increased mental health concerns, and more."
[eliminado],,[removed]
tmahfan117,2014-01-15,"Did you get the vaccine? If “yes” then you might not be 100% immune but you’re more resilient to it. And they do offer Covid vaccine booster shots.

That’s really what happened, Covid still exists, people still catch it, but there’s a vaccine and booster shots now that anyone who wants to get can get. So the world has moved on and now just treats it like the common cold or the flu"
Fantastic-Mention775,2023-10-06,"There’s still plenty to worry about, including those suffering Long Covid, and the damage even a “mild” infection will do.

However, Biden decided the pandemic “was over”, so local governments began to get rid of accessible testing and vaccines, and getting rid of ways of tracking cases. Can’t have high numbers if you can’t see ‘em!

However, there is still so many being like, “omg I’m sick so often now!!!” There are still so many with personality changes, even slight, from the damage Covid does, and then everyone wonders why people are so mean and unhappy now."
Dirka-Dirka,2011-12-19,"I'm vaxxed, so is my family. People still catch it, it ain't going away."
aut0g3n3r8ed,2021-02-27,"Viruses change very, very quickly - which is how we got it in the first place. In order for it to survive, it has essentially mutated to a flu-like virus, that doesn’t cause nearly as much damage as it once did. Combine that change with our own immune systems and vaccines, and it’s no longer a pandemic"
jnighy,2016-03-28,"Vaccines. Vaccines happened. Even in places where most people didn't took it (either for health reasons or stupid reasons), they're benefited from a wide spread coverage"
char_limit_reached,2016-02-14,"The flu has been kicking around, though much less severe, since 1919. Covid is going to be similar. It’s always going to be out there, but its impacts will be lesser due to a variety of factors such as immunization and mutation of the virus. The vulnerable population continue to be vulnerable."
Illeazar,2016-09-18,"Several items at play here.

1) we have vaccines now, so if you get the vaccine you are less likely to get covid, or of you do you'll probably have more mild symptoms

2) a fast-evolving virus like this tends to become more mild over time.  The strains of covid that killed the host or even made them bedridden were less likely to get passed on to another person, whereas the strains you can still go to work with get passed around much more.  

3) the virus is much more spread out in time right now.  One of the biggest problems during the start of the pandemic was how fast it spread--so fast that new people were getting sock and needing hospital resources faster than the hospitals could keep up with.  Lots of people were dying that could have been saved if there was more room in hospitals.  You may remember ""flatten the curve"" as something people were saying at the time.  The meaning of that was to slow down the spread as much as possible, so that even if the same number of people overall got sick, they weren't all sick at the same time, and hospitals would have room to treat people as they got sick.  Now, I'm covid is pretty much everywhere, so while there might be seasons with more cases, in general it isn't hitting everybody at the same time, so people that do need hospital care are able to get it without much trouble."
PunkDoubt,2017-11-09,"I've had employees since November through now, having it. I'm still surprised when I see the doctor's note."
I_might_be_weasel,2017-07-27,We have a vaccine now.
adepressurisedcoat,2024-11-21,People still die from it. But it has mutated so many mild strains that it's less of a threat. You still absolutely can get fucked from it even if you're not immunocompromised.
skiveman,2019-06-17,"I always thought that the main problem with Covid was that it really wasn't the virus that took you down and instead it lowered your bodies response to other new or pre-existing conditions to kill you. From the data I've seen and read it seems that most (I say most because it doesn't cover everyone) people who died were also suffering from (oftentimes) multiple other conditions that were exacerbated the Covid infection. In other words the Covid infection increased your vulnerability to compounding infections and illnesses. 

This is why, while I won't get another Covid vaccine myself due to the side effects I experienced, I did encourage my mother to get one as she has several underlying health conditions that could end her life in the event of a bad covid infection.

In young males/boys though there was an elevated risk in the earlier vaccine that did induce myocarditis. Which was most oftenly seen by the sheer number of young (and apparently) healthy male sportsmen having heart attacks on their various fields of play to such an extent that it was pretty common for a time when watching football (that's soccer to any Americans reading). This has pretty much become very uncommon as the vaccine that caused this was withdrawn and replaced with others that didn't cause this. 

Ultimately if you have underlying health conditions that are serious (say you've had a heart attack or stroke or diabetes) then you should seriously consider getting the vaccine.

As for being immune. No. The covid virus is a lot like the common cold virus in that it likes to mutate quite a bit which therefore makes a universal vaccine or your body to develop immunity to the virus difficult. What happens is that if you get infected then you might develop some resistance to that particular strain of the virus but otherwise you will remain fairly susceptible to new strains of the virus. Same with vaccines as they only target the most prevalent strains each year (hence yearly updated boosters) while they maybe teach your body how to fight similar(ish) strains but you will be susceptible to anything not covered in the booster. It works very similar to flu vaccines."
smedlap,2014-11-20,Covid kills 300 people a week in the us. It is not gone. I am happily vaccinated.
strtrech,2012-11-20,We all injected bleach and were saved by the orange dipshit.
lensfoxx,2020-05-20,"I think it’s becoming a fact of life at this point. We have vaccines and treatments for it, so it doesn’t threaten as many lives as it did when it first broke out. 

It’s still important to practice safe habits around known immunocompromised people (frequent testing, regular hand washing, maybe even medical masks in certain situations), but it’s not as much of a critical risk to society now as it was before. 

I get it though, I knew 2 people who died from it, and my roommate was on a ventilator for 2 weeks and thankfully pulled through. It was very scary stuff."
veinsalt,2021-11-29,"We now have protocols, testing, vaccines, treatments, etc. COVID will continue to be around and will be treated as such along side the flu. We were worried about it because of lack of leadership and unpreparedness as a whole."
ForScale,2012-12-05,What's covid?
matthewmspace,2011-07-13,"It’s not as big a deal now as long as you’re vaccinated against it. I’ve gotten COVID twice after being vaccinated and keeping up with my boosters. I just call my doctor, get prescribed Paxlovid, and that’s it."
Aggravating-Act-1043,2023-07-10,"When young people stop getting vaxed and new strains pop up, it's just a insane move"
rekt_by_inflation,2022-06-29,"Nobody gives a shit, we have new current things now"
Wafflegator,2021-12-16,"The general public realized that life needed to go on because there are in fact worse things then covid. That sentiment coincided with big pharma pretty much milking every last dollar it could from tax payers. Without money to be made or public support, people snapped out of it and left their homes. It turns out that the two years of self-sabotage weren't that helpful and we probably should have left our homes a year earlier.

I had covid 3 times."
No_Nectarine6942,2024-04-22,Not fully immune but we as a whole got it under control reducing it to a manageable level.
worlds_okayest_skier,2018-04-24,Most people have gotten it and have some level of immunity from severe illness
BroccoliNormal5739,2020-06-22,"Back in the day, it was ‘novel’. 

This bit of jargon meant new and no natural immunity. Now some of the population has had it or has had shots. 

Now it is simply yet another virus we will have around forever."
gottapeenow2,2023-08-06,It became less deadly over time and through mutation. Viruses that kill can't spread as well as those that just make their host sick.
pickles_are_delish_,2023-06-22,Never was
FirstOfRose,2023-05-02,"Once the shots were administered to enough people the infection rate slowed it right down. People are still getting it here and there but it’s not nearly as dangerous anymore. Just like the regular flu initially wiped out millions. Some, especially elderly, can and do still die from complications from influenza, mainly pneumonia. It will probably be the same for covid."
[eliminado],,[deleted]
nsfwuseraccnt,2019-05-27,It mutated into weaker strains + almost everyone has some immunity to it now through vaccines and or exposure. It's basically just another common cold at this point.
mochibeaux,2018-09-10,It was all for nothing ❤️❤️❤️
young_arkas,2022-10-31,"Viruses tend to evolve rapidly. All those variants were ways the virus evolved during the pandemic. Generally viruses evolve to be less deadly, since a dead host doesn't produce as many reproductions of the virus as an alive host.

On the other hand, our ability, natural as well as pharmaceutical, to handle COVID has become better. Most people had COVID or a COVID vaccine, that should make our immune system more effective in fighting it. And when someone is hospitalised with COVID, medical professionals have more experience and knowledge to save lives.

COVID has reached an equilibrium, on the one hand, it is still there, people get sick from it regularly (I had it last autumn), but it isn't so deadly, that people do everything to get around it, and it registers as barely another form of flu."
YouDaManInDaHole,2023-07-25,"Herd immunity and decreased virulity, as people predicted at the time.  Plus, the vast majority of humanity is asymptomatic, as it was 5 years ago."
cjae_ripplefan,2021-04-14,"It's the flu, and it always was the flu. (I don't really mean the ""influenza"" virus specifically, I mean the type of illness/impact it was.)"
SnRdVrK,2025-05-22,Control tactic
Super_Skunk1,2021-01-31,"Never took the vac, my uncle did, he died.."
luala,2014-06-12,"I think the deal with severe illnesses is that they become milder over time and generally less fatal. If COVID had reasoning it would think 'it's better to make my host walk around sneezing for a few days and infect lots of other people rather than kill them quickly'. I think that's how stuff like spanish flu ""disappeared""."
lordtyp0,2009-03-15,"Just exaggerate. ""I am out of cocaine and late to the orgy.""."
utopianexile,2020-02-16,The experiment is over they got all the information they needed
BMOisFootball,2024-06-06,Never was
[eliminado],,"Meh. Just another respiratory bug, like Influenza and pneumonia."
Turbulent_Inside5696,2021-12-18,It’s not an election year or it would be a big deal again
toolu1,2021-01-17,Never was.
Realistic-Radish-589,2025-04-17,"Never was anything to worry about. Even during covid I didn't change anything except I couldn't go some places, still hung out, worked and whatever I normally do. Never got the shot and got it once."
JaydenJiggs,2017-01-22,"When i got covid i wasn't vaccinated, i have had colds worse than covid and was pretty much over covid within 3 days but couldn't go anywhere for another 4 days which was shit since i had plans with friends, haven't had it since and have the usual once a year cold, so ehhhhhh covid sucked more the fact that legally i couldn't go anywhere more than the fact it was just an average cold in my case"
coyocat,2017-06-22,"Always considered covid a joke even at t/ height of its PWR  
Never got it and i was around t/ dirtiEST people in t/ state : )"
brainshreddar,2024-09-10,It's just a cold now.
SmartStatistician684,2020-08-02,There never was 🤷‍♂️
Breakin7,2021-12-10,It was a flu thats all but social media and the news fucked us all.
Keyboardknight8p,2024-03-30,Covid is looked at like a common flu now days. I’m sure if they had a 100 cases most of the world would t care
anonymousscroller9,2023-05-25,Effectively yes. This is like asking what happened to the flu
Bathroomabuser,2018-12-25,It's basically the flu except there wasnt a readily available cure for it.
AdrenochromeFolklore,,We handled it so well that it has become eradicated.
[eliminado],,"I had it last year it took my whole house down for literally a month.  It was terrifying.  

We are young, not immune compromised.

Thank goodness we had previously been vaccinated.  We were due for boosters soon, but technically current."
Busy-Pudding-5169,2021-01-29,Everyone is vulnerable to it. What are you talking
TrannosaurusRegina,2017-10-25,"For comparison, HIV (a virus which is very similar to SARS-COV-2 in many ways) also often has few or no symptoms, often for many *years* after infection.

It would be pretty absurd to say the “immunocompromised people are still vulnerable to HIV”, because HIV, like SARS-COV-2, *causes* damage, dysfunction, and immunocompromise!

The difference is that HIV is limited to the immune system can easily be tested, as well as treated, while SARS-COV-2 can fuck up *any* part of the body, cannot be easily tested for (because it’s not always in the blood), and there is no good treatment found yet.

*Every infection* fucks up something, even those with zero symptoms whatsoever, and every infection is another chance to get long-term, possibly permanent damage.

Losing sense of smell or taste (or having everything taste disgusting) is the most distinctive symptom, but people commonly lose abilities that they didn’t even know they had.

If you want to play Russian roulette, that’s up to you, though I certainly won’t be joining in!

Reminder that the mRNA vaccines only do anything for six months, after which time you’re worse off than before.

Definitely recommend Novavax if you can get it (which does *not* have this problem), though there’s no vaccine that can end this until they finally get an intranasal vaccine working in humans.

For anyone who likes to base their decisions on actual data:

https://pmc19.com/data/"
[eliminado],,Why are way more than that dying of flu and pneumonia?
BootyMcStuffins,2022-06-13,"It’s such a small sample size, I bet 300 people die per week from all kinds of things

Edit: Omg sample size was the wrong word. Calm down people.

300x52=15,600 deaths per year. That’s a tiny amount to be clutching your pearls over. Go ahead and compare that to the flu, or falling…."
AdImmediate6239,2024-10-24,Too bad they’re trying to limit boosters now only to people 65 or older and people with pre existing conditions
Breakin7,2021-12-10,The vaccine you took years ago is useless by now.
isabelladangelo,2014-05-23,">Like any illness with a vaccine that’s available, it has become way less of an issue because people now have some level of immunity from vaccines or infection. People still get sick & die, but in way fewer numbers due to the vaccines.

This is misinformation.  The reason is that [the virus has evolved](https://www.who.int/publications/m/item/covid-19-epidemiological-update---24-december-2024) to be [a lot milder](https://www.bbc.com/future/article/20250113-why-covid-19-is-becoming-less-deadly)."
Degen_parlays,2022-08-19,And people dying from covid was already incredibly low. 99% survival rate
[eliminado],,[deleted]
TrannosaurusRegina,2017-10-25,"Except we don’t have any idea of deaths because SARS-2 fucks everything up, so it contributes to any death of anyone who gets infected (many of whom do *while* they’re in the hospital, since most hospitals practice zero airborne infection control.)

It’s way undercounted, plus the focus on death is strange, considering it gives many more people a fate much worse."
trumpet575,2017-01-02,"0.0001% of the population

0.6% of the total deaths

About [twice as many (692) people die from the flu every week](https://www1.villanova.edu/university/health-services/health-wellness-resources/common-illnesses.html) compared to the number you gave for COVID and that's an understood reality

I don't want to diminish the lives of the people that die from COVID, but from a national standpoint it's basically a rounding error at this point

*Edit (since you deleted your comment accusing me of not caring about it when thousands were dying per week from COVID)*: When it spiked to around 1/3 of total deaths during a ""normal year""?  Yeah, that was the focus and why we needed to ""stop"" it.  Stopping it being getting it down to the point where it is today, and likely will stay for the rest of our lives."
Royal-Jackfruit-2556,2025-02-26,Probably doesn't get as much attention now because of how little people are dying from it. Compare it to cancers and flu the numbers are tiny.
BootyMcStuffins,2022-06-13,"Do you realize what a small number that is?

This is less than half the number of people that die of sleep apnea each year. 

It’s about 15% of the people that die from air pollution each year.

People don’t care because 300/week is a mostly solved problem. It isn’t even a contender for the disease killing the most elderly people

All that to say, I think people have their priorities straight."
DocBullseye,2017-04-19,But those are people old enough to run for President
xstex-,2018-06-06,"Nobody cares because its less deaths than the flu. Most people, even the vulnerable will be fine if they're jabbed."
InformalYesterday760,2025-03-07,"Hopefully research into it continues and relief can be found for those folks sooner than later 

I met a university maths professor who would crash out after doing anything more strenuous than simple addition"
Famous_Fondant_4107,2020-10-16,Agreed
BootyMcStuffins,2022-06-13,"300 x 52 gives us 15,600 deaths per year. This is an incredibly low number. Half to 5 times less deaths than the flu depending on year.

I don’t think people are doing the math on how small a number 300/week is, or they aren’t thinking critically and comparing it to the other issues that need our focus and resources"
CannonCone,2013-03-19,The Trump administration is also removing our ability to get yearly boosters for those who aren’t old or immunocompromised. I suspect Covid is going to become more deadly again in the coming years as a result :/
MarzipanCheap3685,2025-04-10,"the cough is terrible. I had it in December untill mid January as a healthy adult. I still have a cough. It's not as horrible as it was a few months ago, but it was brutal. My entire family got it despite being vaxxed and boostered most recently in October. So I probably would've died or something if I hadn't been vaxxed."
TrannosaurusRegina,2017-10-25,"This is a lovely soothing fairytale people like to tell, however I’ve seen no evidence of this, least of all regarding SARS-2!"
64Olds,2013-02-14,"I feel like this part is super underappreciated. Every infection puts you at risk of long COVID, brain inflammation, chronic fatigue, etc. It's still a big, big deal. We just don't acknowledge it because there's really nothing we can do."
zkpenguin,2018-11-14,"Had to scroll wayyyy too far to see someone mention Long Covid. It can be debilitating and each time you get Covid increases your chance for complications. It's so not worth the risk. Wear your masks, people!"
TrannosaurusRegina,2017-10-25,"Yep; young athletes who’ve become bedridden, and peoples’ lives ruined in ways too horrific for most people to even imagine.

There *are* many fates worse than death it turns out!"
InformalYesterday760,2025-03-07,"Not a fan of vaccine disinformation sneaking into the thread there 

Long COVID and CFS due the virus is a big issue, feels weird to try and get in some hit against the vaccines that protect against those longer term symptoms"
xMediumRarex,2020-12-30,"I got Covid 2 years ago, it was fairly mild other than being really fatigued. 

But. Ever since, I’ve felt dizzy. It hasn’t gone away, nothing I do fixes it. It really really sucks."
shiny1018,2021-12-07,"Hmmmmmmmm, it seems as though lumping covid and the covid vaccines together is a bs move. Please provide credible numbers for people diagnosed with long covid after [only] being vaccinated [but not diagnosed with covid]. Also correlate with age and health."
ffffux,2014-07-18,"Yep. Check out r/covidlonghaulers and r/cfs (the latter ofc an illness that’s been around longer, but many people had it triggered by a covid infection)"
AnthonyThe6reat,2015-03-02,"So happy seeing the truth in the wild with upvotes. I am personally damaged by the covid vaccine for 3 years and 3 months. Ruined my life, anyone with long covid or vacc injury, I am praying for you.

EDIT: so the guy above me claims vacc injuries are real but when I come forward I get downvoted, god I love reddit."
WinterWontStopComing,2019-01-27,Completely glossing over some crazy problems people are developing during or post illness with COVID still
[eliminado],,"""most people are mostly immune to"" - viruses mutate. get vaccinated."
Complex_Willow_3452,2024-09-09,It’s not seasonal if it spikes in the spring and summer too
BootyMcStuffins,2022-06-13,"Is that a high number, or a low number?"
Famous_Fondant_4107,2020-10-16,💯
InformalYesterday760,2025-03-07,"Subjective observations like this offer no valuable insight 

We have the data, the studies, the numbers - the health outcomes post virus are FAR worse than the outcomes post vaccine."
Plutarch_Riley,2022-07-08,Do you consider traditional protein subunit vaccines as dangerous as mRNA ones?
Xytak,2017-08-14,This comment is a textbook example of anti-vaccine disinformation.  Knock it off.
allmimsyburogrove,2022-01-27,whatever you say openminded
jhewitt127,2019-09-03,"Dunno what country you’re in, but in the USA the current administration might be getting rid of that “anyone who wants to get it” part."
kenrblan1901,2014-03-10,"Although this is mostly accurate, do remember that the current US administration is trying to reduce access to the boosters."
[eliminado],,[deleted]
[eliminado],,[removed]
LifeguardOld557,2021-11-14,Why are you surprised when people get sick from a pandemic? Just because the virus isn’t as lethal (thanks evolution) does mean people won’t continue to get sick from it.
Famous_Fondant_4107,2020-10-16,"You may want to mask up as well! The covid vaccines are great but they don’t stop transmission,"
[eliminado],,what's a million deaths to a cult? nothing it seems. we're fucked.
growltigrif,2022-02-14,"That's the opposite of what the research says. 

Research tells us that the risk of long covid and risk of permanent damage to any of the body's systems increases each time a person gets covid. And immediate symptoms with reinfection can be worse than the first time.

I don't care that it is endemic. I'm not messing around with covid, so I still do what I can to reduce my risk and I keep asking people around me to do the same. Mask indoors in public spaces, meet and dine outside when possible, avoid being in crowds before I visit with my immune-compromised friends and family, stay home when I'm not feeling well even if I test negative."
twoDuckNight,2025-04-11,Go fuckkkk yourself
breesybaby77,2020-01-30,💯
Neat-Cold-3303,2023-07-27,"Covid has not been eradicated.  It is still a deadly disease particularly for older people.  Remember, because of all the misinformation out there  many people have opted to not get vaccinated.  Hence the continuing threat from covid."
Famous_Fondant_4107,2020-10-16,Wastewater data will tell you otherwise.
geoshoegaze20,2020-12-03,Took me down 22 days last September and made me more susceptible to influenza A and adenovirus both of which nearly killed me.
KandyVenom,2020-01-18,My whole family had it within the past 6 months and the worst of it was over in only a few days. We are all unvaccinated.
Apprehensive_Pilot43,2020-08-24,I guess that vaccine really worked eh?
[eliminado],,[removed]
V12TT,2014-11-19,For most people symptoms are between common cold and flu. Not exactly vulnerable.
