Usuario,Fecha_Creación,Comentario
kammycakes,2016-07-04,"There’s a mix of truth and nonsense in this, but a lot of it’s either misleading or flat-out wrong. First off, HIV and SARS-CoV-2 are not “very similar” viruses. They’re both RNA viruses, sure, but that’s about where the similarity ends. HIV is a retrovirus that attacks and integrates into the immune system directly, while SARS-CoV-2 is a coronavirus that hits multiple systems in the body but doesn’t embed itself in your DNA like HIV does.

It’s true that HIV can be asymptomatic for years, but trying to draw a 1:1 comparison with COVID isn’t accurate. They operate differently, spread differently, and impact the body differently. Saying it would be “absurd” to claim immunocompromised people are vulnerable to HIV because HIV causes immunocompromise makes zero sense. Being immunocompromised actually makes HIV worse if you get it, not irrelevant. As for testing, no, SARS-CoV-2 doesn’t “hide in the blood” or evade testing. We don’t test blood for it because it primarily infects the respiratory tract, and PCR and antigen tests work just fine when done correctly. HIV is tested via blood because it lives in blood cells. Totally different context.

The part about there being “no good treatment” for COVID is outdated. We have multiple treatments that reduce severity and prevent hospitalization, like Paxlovid and remdesivir. They’re not miracle cures, but they work and are widely available. The idea that every single SARS-CoV-2 infection causes lasting damage, even in asymptomatic cases, is overstated. Long COVID is real, and reinfections can carry risks, but not everyone who gets infected suffers permanent harm. That’s fear-mongering. It’s possible, not guaranteed.

The vaccine claim is just false. mRNA vaccines don’t “leave you worse off” after six months. Protection against infection does wane over time, but they still offer strong defense against hospitalization and death. Boosters help with that. Novavax is a solid option for people who don’t want mRNA, but it’s not magic either.

Lastly, that [pmc19.com](http://pmc19.com) site isn’t a legitimate scientific source and it looks like a pre-web 2.0 landing page for someones MLM scheme. I don't think that would be my go-to source for medical information."
BanMeForBeingNice,2024-08-12,"\> Reminder that the mRNA vaccines only do anything for six months, after which time you’re worse off than before.

Got a credible source for this?"
jspace16,2016-10-11,Because covid weakens your immune system.
inaname38,2015-01-24,"300 per week is now, in a lull. Deaths are much higher during the covid waves we get 2+ times per year. 

The week ending January 12 had over 1,000 Covid deaths in the US, for example. 
 https://ourworldindata.org/grapher/weekly-covid-deaths?time=2025-01-12&globe=1&globeRotation=44.76%2C-103.57&globeZoom=1.66"
lotsofsyrup,2011-11-08,"yes and this is IN ADDITION TO THOSE THINGS.  Nobody is saying the total portion of people who will ever die is going up, that is gonna remain at a flat 100% bud.  This is extra deaths that would mostly not have otherwise died, in that period of time."
BatmanOnMars,2017-02-23,It isn't a sample if they are counting everyone they can who dies of covid.
Certain_Bandicoot_14,2024-12-24,Not sure you understand what a sample size is.
Baxter-Buddy,2023-11-06,"Here, everyone is offered annual boosters"
joelene1892,2020-02-28,r/usdefaultism
Affectionate_Big8239,2022-05-01,"Which is why we have boosters and updated vaccines, like with the flu."
ncolaros,2012-12-06,"The disease itself self-selects for symptoms that don't kill its host. After all, hard to spread the disease if you keep killing the carriers. 

That said, I'm not an expert and have no idea if the initial vaccine is helpful, a little helpful, or useless at this point, given the mutations the virus has undergone.

Not sure why I'm getting downvoted. Viruses in general self select for not killing their hosts. That's not up for debate. I am in favor of everyone getting a COVID shot every year regardless."
Affectionate_Big8239,2022-05-01,"Viruses can become more mild because they are replicating and mutating through fewer people.  Vaccines and immunity rates are the exact reason we don’t have killer flu epidemics like 1918 and why some covid strains are more mild.  If viruses don’t get the chance to mutate like crazy, they can become more easily managed (including the development of treatments for symptoms and diseases)."
SongofIceandWhisky,2018-01-15,The long term damage has not evolved to be milder. Also there are reports out of Hong Kong of the new variant causing knife-like pain in the throat. Mild? No thanks.
BookLuvr7,2021-09-05,Milder my ass. It depends on genetics. My in-laws have had it for weeks and they're still sick and exhausted.
LookinAtTheFjord,2024-04-26,"A vaccine that does what vaccines do is misinformation?

lol k. 🙄 What a joke of a comment."
adepressurisedcoat,2024-11-21,With a population of 8billion people that still means 80 million deaths worldwide.
10catsinspace,2016-05-24,Which would mean 3.4 million deaths in the US alone if everyone got it without vaccine supported immunity.
Radiant_Bank_77879,2023-11-04,"That lie will never be true no matter how many times Fox News told it to you. I don’t know why right wingers think that if you just keep repeating a lie over and over again, it magically becomes true. It is absolutely insane that people are still repeating that lie all these years later when any educated person knows it isn’t true. That’s sadly how the cult of anti-intellectualism in America works today though. 

Not to mention that even if it were true, one in 100 people is a *lot* of deaths. Would you eat at a restaurant where one in 100 people who eat there die from the food? 

I don’t know why right wingers need basic rational thought spelled out to you in crayons like this. But it sadly has to be, on every topic."
tnderosa,2022-08-01,Do you like to make up numbers in your head?
shiny1018,2021-12-07,"True, but the survival rate from the flu is much greater than 99 percent, and the flu is a serious public health issue. Try this on for size: 300,000,000 people in the US * 20 percent infected * 0.005 morbidity = 300,000 dead Americans. Obviously, the US fared less well than that."
twats_upp,2015-03-03,"The flu was a novel virus initially too, right? (Influenza)"
BootyMcStuffins,2022-06-13,"Just to add some color, way way more people die of the flu every year. Flu deaths are double COVID deaths on the low end to about 5 times higher during a bad flu season"
PlasticElfEars,2018-11-20,"What I could find easily, CDC says in its ""preliminary burden"" estimates:

Deaths from flu during the 2024-2025 season: 27,000-130,000

 Deaths from COVID during the 2024-2025 season: 30,000-50,000

Sources:

https://www.cdc.gov/flu-burden/php/data-vis/2024-2025.html

https://www.cdc.gov/covid/php/surveillance/burden-estimates.html"
PuzzleMeDo,2020-03-06,"It is weird how we can be so casual about something like that. If terrorists were murdering 350 people a week, we wouldn't say, ""Oh, that's a tiny number, nothing to worry about."""
TechnoMaestro,2013-07-24,"Not preventing preventable deaths seems to be a case of priorities being well out of alignment, actually."
SongofIceandWhisky,2018-01-15,"Unfortunately we are still having excess deaths not directly attributable to Covid. It’s likely because Covid dramatically increases one’s risk of heart attack, stroke and cancer."
diggerhistory,2016-05-13,"Australia does. Very strong government campaigns warning the public of the risks. FREE for over 65. 
Flu shots same strong warnings. Also FREE for over 65."
TrannosaurusRegina,2017-10-25,"This is simply false information.

Every infection causes damage, even if you have zero symptoms.

The body can often compensate for damage and heal, until it can’t."
t-o-m-u-s-a,2022-01-03,Or something I guess
akera099,2010-08-10,"No evidence? That's literally what virus strains are, like influenza."
derango,2006-08-09,"Occasionally a mutation pops up that amps up the danger you can’t totally discount that as a possibility. But in general the trend over time is mutations that spread more easily but cause less severe symptoms. 

Basically a virus can’t spread if it kills you."
sc94out,2020-12-14,"How is there nothing we can do?? I think people have it in their recent memory exactly the kinds of things we can do. Wearing a well fitting high quality mask does a lot to reduce transmissions.

Early pandemic measures were so effective that a strain of the flu literally went out of existence. We have a lot of power to change our public health landscape, though we have been put at a disadvantage through total government negligence and deliberate lies about the pandemic being over instead of real education."
littlebitbrain,2020-10-24,"Yep, and no one cares, unfortunately. If I had to choose between long-covid and dead, I'd certainly choose dead because it's quicker."
they_ruined_her,2024-02-13,"Yeah, this is why it's impossible to have serious discussions anymore. Everyone wants to bring their dumb baggage in. We can't address serious long-term issues with COVID without triggering the dumbest humans imaginable."
[eliminado],,"I have a friend, 40 year old female, otherwise relatively healthy, who has developed very severe CFS immediately after getting vaccinated. It has been 2 years since she is bed bound and cannot even sit due to ortostathic intolerance, can barely eat. Are you gonna tell her that she is spreading misinformation and is lying? 
In my country (inside EU) a young girl in her 20s, also healthy, died immediately after getting the vaccine, it was officialy registered as the cause, and was all across the news, triggered massive protests. Are you going to tell her parents that they've made it all up?
I didn't write the comment to start this dispute bc I really don't care anymore, everyone has their own opinion and I don't have the energy to argue since I am also bedbound due to CFS. But these stories should be heard."
[eliminado],,[deleted]
AdImmediate6239,2024-10-24,Source: trust me bro
stockinheritance,2014-04-19,"bike hobbies deserve paltry late skirt roll start snatch steer

 *This post was mass deleted and anonymized with [Redact](https://redact.dev/home)*"
Better_Software2722,2023-09-20,My GP has been fighting long covid for a year. Amazing that he can still do that. Good on you Dr Royer
Linus_Naumann,2018-12-27,"People die or have long-term symptoms from the regular flu too. It's just regular life-risk at some point, can't stop the world from turning forever."
SerOsisOfThuliver,2025-02-05,agreed but vaccinations are also known as...immunizations
FenisDembo82,2022-09-08,"JFK Jr [EDIT: RFK jr]  has decided that most people can't get vaccinated anymore,  so good luck"
SituationNice7520,2025-02-22,"No vaccines for healthy people or kids here.

EDIT: I meant here as in the country. I've gotten vax and boosters."
[eliminado],,[removed]
CaptainAwesome06,2013-12-06,"The party of ""it's my choice not to get it!"" isn't going to give people the choice to get it. Making a virus political has to be the dumbest thing we've ever done."
capowis542,2025-05-13,Get it ASAP. I loaded up on every vaccine I could reasonably get back in January for obvious reasons.
Famous_Fondant_4107,2020-10-16,"It’s still a big deal, vaccinated or not.

Your father is correct that you can still get Covid if you are vaccinated for it. The vaccine may help keep you out of the hospital, but it won’t stop transmission and it doesn’t necessarily prevent Long Covid. There is no cure for Long Covid. 

N95/FFP3 masks are the best way to protect ourselves, along with air ventilation and filtration.

Stay safe!"
Agreeable-Camera-382,2024-07-14,Medical researcher here who worked on the covid vaccine.... this is misinformation
capowis542,2025-05-13,You’re a joke.
CaptainAwesome06,2013-12-06,4/10 troll
pokotok,2015-03-11,This is a joke right?
TrannosaurusRegina,2017-10-25,"There’s no single vaccine.

There’s Moderna’s shitty mRNA vaccine, there’s Pfizer’s even shittier knockoff, and then there’s Novavax, which has none of the risks or of mRNA, and is far more effective and long lasting (seemingly infinite vs. 6 months max)"
mickeyflinn,,So just like all vaccines and treatments?
AdrenochromeFolklore,,People didn't get vaccinated because they rushed the vaccine I thought.
Camalra,2021-12-03,"I have come to the same theory that I am susceptible to more things now after Covid. I say theory because I did not check it because I only thought of it today. I was vaccinated in the first years.

 Then, last year in August, I got Covid. The first 3 days were worse, after that I was better with every day. But I had head aches and cough for almost 2 months. 

Since October, I took all kinds of viruses, and this year, influenza. I do not remember when I had Influneza last time (if I had it), even if I was not vaccinated. 

Someone said to me today that maybe because of the vaccine, am I always sick. But I really think that Covid did something to my immune system. Because I am always sick only since Covid."
BrieflyVerbose,2024-09-20,"Congratulations, good for you. You and your family are lucky.

Not everyone was that lucky. I lost my 33 year old friend, he was a big 6'3"" rugby lad. For and healthy, just had his second child about 4 weeks previously. He died in hospital leaving his family behind. My other friend's wife got it about 4 years ago, she's not worked since. She's lucky to be alive and is still suffering.

Also, I'm going to address that absolute fucking nonsense you spoke about vaccine deaths. I'm a biomedical science student, this is a massive part of what we study. Out of around 14 billion vaccines administered across the world, we have roughly 120 deaths linked to the vaccines.

That is a very small number. I can't explain enough about how insignificant that number is in terms of data and percentages. Stop spreading misinformation."
BookLuvr7,2021-09-05,"Thank your lucky genetics, not your vaccine status. It killed my mom."
Agreeable-Camera-382,2024-07-14,"Medical researcher here who worked on the covid vaccine. You got lucky, but the people you may have spread it to might not have if you didn't quarantine."
[eliminado],,It affects some people differently everyone dna is not the same but cool for you but everyone doesn’t have the same immune system as you it’s not no dumb conspiracy theory like a lot of idiots believe it is.
contrarymary24,2023-12-30,"I’m not sure why you’re getting downvoted. 

I think the virus has gotten more agreeable to its host over time. Easier to survive! Glad you got through it ok."
Imapieceofshit42069,2021-09-26,Crazy my family got vaccinated too and we basically all got it at one point from one of us and they all got super sick and I didn't even notice. Am also unvaccinated.
MyWifeisaTroll,2019-03-31,Yes it really did. Notice how the commenter's said they were really sick but didn't end up in the hospital? It means the vaccine works.
Muted_Emu_7006,2025-02-17,How many times do we have to explain it to you dolts?!?
TecumsehSherman,2010-08-19,"Better than your horse paste!

What was your favorite flavor? Was it apple? I bet it was apple."
Muted_Emu_7006,2025-02-17,How many times do we have to explain it to you dolts?!?
whatshamilton,2017-02-19,"Where is your medical degree from? Everyone I’m learning from has a medical degree from a reputable university and says you’re wrong. So if you also have one, share the credentials."
Bluehen55,2020-10-15,They don't because it's a lie
TrannosaurusRegina,2017-10-25,"There was a great study I saw a long time ago showing how mRNA shots provide pretty good protection for a few months, before dropping *below baseline* after six months.  Of course these companies want to push this subscription-ass vaccine model!

Novavax didn’t drop off substantially at all (though a primary series of at least three is needed for best protection)

Unfortunately I’m not organized enough to have it at my fingertips right now — just in the process of getting my PC built!"
re_Claire,2016-03-18,"Far too many people underestimate the effect COVID has had on people. Weakens your immune system, and can cause long lasting effects. After I've had COVID I developed allergic asthma in the summer for 2 years running and had to go on a steroid inhaler. Post COVID syndromes have caused brain fog, memory problems and chronic fatigue in many people. Long-covid being the worst of this."
BootyMcStuffins,2022-06-13,"You’re misunderstanding me.

That’s 15,600 deaths per year. That’s basically a statistically insignificant number when you consider the other diseases killing people.

To put it into context. About double this number dies from homicide in the US. Sleep apnea kills over twice that many people. Air pollution kills 100,000 people in the US each year"
BootyMcStuffins,2022-06-13,"Sorry, sample is the wrong word.

300x52=15,600 deaths per year. Which is not a statistically relevant amount. Compare it to basically any other cause of death. The flu has double to five times the number of deaths."
BootyMcStuffins,2022-06-13,Yeah it was the wrong word. Edited my comment
AdImmediate6239,2024-10-24,Where is “here”?
re_Claire,2016-03-18,Usually I'd be on board with this but sadly the UK only offers boosters to people over a certain age and with certain pre-existing conditions.
totally-not-god,2020-07-15,"You’re on an American app, made by Americans, and its most active users are also Americans. Get over it."
Breakin7,2021-12-10,Nobody take those.
Breakin7,2021-12-10,"Useles 100% 

Flu vaccines are good for 1 mutation usually one winter.

Plus any vaccine can loose power with time"
isabelladangelo,2014-05-23,I provided actual links to actual articles rather than just spitting it off off the cuff.  Please provide the same courtesy by posting links and not conjecture.
isabelladangelo,2014-05-23,">Milder my ass. It depends on genetics. My in-laws have had it for weeks and they're still sick and exhausted.

Feel free to argue that with the BBC then."
isabelladangelo,2014-05-23,">A vaccine that does what vaccines do is misinformation?

>lol k. 🙄 What a joke of a comment.

Of course, I forget.  This is reddit.  Allow me to break down the comment thread for you.  Person A posts that the vaccines are working, that's why COVID is not a thing.  Person B posts that that's not true with links proving why it's not true - that the virus is just getting milder and not killing as many people.  It does **not** mean that there aren't problematic issue with catching COVID, just that you are less likely to die from it.    

Basically, it's the evolution of the virus with it getting milder and the vaccines only work for 6 months so...they aren't even a factor to it getting milder, really."
Degen_parlays,2022-08-19,"Anti-intellectualism? 😂 Buddy how's the view from your ivory tower? What is the lie? I just provided a source from AP saying the data. The fact that you weirdos still have tribalism involving Covid is insane. 5 years later and you guys still don't realize you were on the wrong side of history.  

I guess it's easier to fool someone than it is to convince someone they've been fooled....I feel bad for you. I truly do. I just want to help and bring common sense into your life."
[eliminado],,[deleted]
Degen_parlays,2022-08-19,"Sorry, 98% but since we know numerous deaths were classified as a Covid death when in actuality it wasn't, I'd still say the number is 99%. What the hell is wrong with you guys? You'd think you'd realize by now you've been lied to. Trust the science!....well the science tells you Covid is a cold

https://apnews.com/article/fact-checking-970830023526"
diagana1,2011-11-10,There are a bunch of flu viruses and some only infect humans. Hard to say
herpblarb6319,2011-08-17,It started out as the Spanish flu and was one of the most deadly pandemics (1918-1920) in history.
junkfunk,2010-08-17,Same reason doctors suggest the yearly flu vaccine
Ghigs,2012-04-12,"Their methodology is pretty weak.

https://www.cdc.gov/covid/php/surveillance/about-burden-estimates.html

They collect data on positivity rates for admitted patients from a few select hospitals and then multiply it by a number.  Then multiply it by another number again, to try to make up for ""undertesting""

And then multiply that number by another made up number to estimate deaths, because they say they can't rely on death certificates.

That final number you quoted could be made to say pretty much whatever they want it to say by tweaking their multipliers a slight amount."
TrannosaurusRegina,2017-10-25,"Right?


People just don’t want to acknowledge airborne disease transmission, don’t want to spend money on clean air, and *definitely* don’t want to mask in public, so they handwave it away.

A well-fitting sealed KN94-standard respirator mask or better is practically impervious (as long as it doesn’t get wet!), but most people are too afraid of the social stigma of masking to do it (or they don’t want the hassle).

3M Aura N95s are my personal favourite — very comfortable and well-fitting compared to most!"
BootyMcStuffins,2022-06-13,"More people are murdered in the US than die of Covid and we pretty much accept that as a fact of life.

More people die from falls than by dying of Covid (by A LOT) and it’s not like we’re advocating for people to wear helmets when they climb ladders. Because it’s just a fact of life."
Flimsy_Fortune4072,2022-01-07,"It is not that weird. It is easy to empathize when it is one person. When it is hundreds, or thousands, it is just a statistic to most people."
[eliminado],,[deleted]
xstex-,2018-06-06,"My ""nobody cares"" was more tongue in cheek for OP. People do care, it's just much easier to deal with now. Its also free in the UK for the elderly (not sure the age) I'm pretty sure its a combined flu and covid jab here."
xstex-,2018-06-06,Tell the doctors mate as what I said is correct for the majority of people. I'm not going to go back and forth with someone who thinks we still should be wearing masks.
MarzipanCheap3685,2025-04-10,I'm alluding to other long term health effects that aren't as bad as dying
magic_crouton,2018-09-30,And other sars varients
TrannosaurusRegina,2017-10-25,"Indeed!

I mean of course there are *some* of us who care, and fight this rather quietly, getting people Novavax and mask access, etc, though we’re pretty marginal these days I’ll admit.

A lot of regions do have Facebook groups for those of us still living in the real world to have community and help each other through this at least!"
InformalYesterday760,2025-03-07,"This particular piece of disinformation was spread on Joe Rogan's podcast and corrected, on the air, by a  guest

*In his 12 January 2022 episode, Rogan claimed the risk of myocarditis (heart muscle inflammation) among vaccinated 12- to 17-year-olds was higher than the risk associated with catching Covid.

But his guest, the Australian broadcaster Josh Szeps, argued that, in fact, young males infected with the virus were up six times more likely to develop myocarditis as those who had received the vaccine. Szeps cited data from the US Advisory Committee on Immunization Practices, suggesting a rate of about 450 myocarditis cases in every million Covid-19 infections among boys aged 12-17, compared with 77 cases a million after vaccination.

Separate data from 38.6 million people aged 16+ who were vaccinated in England identified an extra two to six myocarditis cases in every million people in the 28 days after receiving a first dose of the AstraZeneca, Pfizer or Moderna vaccines, and an extra 10 cases a million after a second dose of the Moderna vaccine.

This compared with an additional 40 cases a million people in the 28 days after a positive Covid test.*

https://www.theguardian.com/culture/2022/jan/31/joe-rogan-covid-claims-what-does-the-science-actually-say"
ncolaros,2012-12-06,"Many more have developed these types of problems *from the disease.* You antivax people never seem to talk about that.  

Some people get food poisoning. Does that mean we should all stop eating?"
5Hjsdnujhdfu8nubi,2022-08-30,"People (in general) develop myocarditis due to catching COVID, and at vastly more likely odds. Plus all the extra symptoms from having that disease.

Not to mention the fact that most cases of Myocarditis are mild and resolve by themselves and that in the UK  the incidence rate of vaccine-related myocarditis was *10* reports per **million** doses for Pfizer (and 14 for Moderna). For people under 18 it was even lower.

It really wasn't something to be massively concerned about. You can probably find worse side-effects that are more likely to occur in less cared about vaccines if you tried."
IndecentMemories,2025-05-26,"myocarditis is rare, treatable, and much less serious than covid"
SnooStrawberries620,2020-08-25,"That is true, backed by the FAERS data. At a fraction of the rate at which they develop myocarditis as a result of the virus though. 

The life altering money is still heavily on being safer with the shot."
AnthonyThe6reat,2015-03-02,"Idk what you want me to do, do you want me to send you the after doctor summary where they diagnosed me with vacc injury?"
