Usuario,Fecha_Creación,Comentario,Polaridad,Sentimiento
TheUnAndOnly,2015-03-01,I think he meant it will make about Boomfiddy.,0.0,Neutro
Aurailious,2011-12-23,How ironic is it that your comment is basically being cynical?,-0.19999999999999998,Negativo
captpiggard,2011-01-21,"Due to [changes in Reddit's API](https://www.theverge.com/2023/6/8/23754183/apollo-reddit-app-shutting-down-api), I have made the decision to edit all comments prior to July 1 2023 with this message in protest. If the API rules are reverted or the cost to 3rd Party Apps becomes reasonable, I may restore the original comments. Until then, I hope this makes my comments less useful to Reddit (and I don't really care if others think this is pointless). -- mass edited with redact.dev",0.05925925925925925,Positivo
abagofdicks,2010-12-27,The Wizard of Oz then?,0.0,Neutro
liketheherp,2014-07-25,"Entertainment has replaced religion as the opiate of the masses.  

Now if you'll excuse me I'm going to look at pictures of kittens until it's time to clock out.",-0.05,Negativo
MulderD,,Sweet... I don't have to pay to see it now.,0.35,Positivo
Leaflock,2010-09-14,"A screenwriting book I read once said something to the effect of, ""you can tell the same story over and over as long as you make the characters and situations interesting.""

Note: I'm not a screenwriter, I was curious about the process.",0.0875,Positivo
Aurailious,2011-12-23,"> backstory for their Space Mountain ride at Disneyland

Are they just going to do movies for all their rides now?",0.0,Neutro
Tainlorr,2011-06-28,Bring on the Materrhorn movie!,0.0,Neutro
frockinbrock,2010-02-05,"Also worth noting: while the Walt Disney world florida Space mountain is 40 years old, they also have 4 other space mountain rides around the world (it's at their magic kingdom themed parks). So when you factor in the visitors per-park, per-year... Well, I can at least see how there is a real market to make a film to go with it.

I actually have a bit more faith in the quality and profitability of Tomorrowland than I do with the new Cinderella. But then, I suppose Sci-fi is more my cup of tea.",0.18113636363636365,Positivo
[eliminado],,"I keep getting the same age, and my daughter gets older. Or something.",0.08333333333333333,Positivo
[eliminado],,Not sure if you mean steve aoki or the assassin dj,-0.28125,Negativo
Steampunkman,2013-07-24,Too soon. :(,-0.75,Negativo
shaneo632,2012-06-27,Why do they always give us dumbshit titles over here?,0.0,Neutro
[eliminado],,"I only just noticed her John Lennon t-shirt. It looks like they may be drawing parallels between Tomorrowland and the world of John Lennon's ""Imagine.""",0.0,Neutro
anotherkeebler,2008-10-17,And I just noticed the nixie clock next to Clooney was counting *down*. It has about 684 days left before it reaches zero.,-0.05185185185185185,Negativo
[eliminado],,"The guys name isliterally filmfanatic5. That's a marketing name if I've ever seen one. But is that bad? Quickly posted trailers on movies we're interested in seeing posted by a disney rep isn't bad. Ifwe don't want them we'll downvote them, yeah?",-0.2041666666666666,Negativo
Mathiasvs,2013-03-16,He may just be a fan of those movies.,0.0,Neutro
[eliminado],,It's pays ok. It's the perks that make Disney a cool place to work.,0.425,Positivo
emmanuelvr,2013-01-27,They might still get him for the next SW Too.,0.0,Neutro
mabba18,2010-08-31,Might as well start calling films disneys now.,0.0,Neutro
lollerbladder,2012-11-07,that's true i suppose. i wasn't saying anything negative about the director; i liked both the movies. i just didn't realize they were directed by the same guy,0.16249999999999998,Positivo
[eliminado],,"I guess.  The Marvel films are commercial for toys, though, not comics, which are nowhere near their mid-century peak.  The comics business today is tiny.",0.03333333333333333,Positivo
friendofhumanity,2014-04-02,"I mean, that idea makes sense, but also Disney has already made some pretty good stuff with Mickey. They just have to work around it. It just seems weird that they would let one of their flagship franchises die like that.",0.03437499999999999,Positivo
[eliminado],,"Yeah... but in kingdom hearts he went around wailing on some ass with a bunch of hentai kids, ALL OF WHICH had giant keys that could destroy worlds, but were pretty much solely used for caving in faces.",0.0625,Positivo
m-jay,2014-06-20,( ͡o ͜ʖ ͡o),0.0,Neutro
scarfdontstrangleme,2013-12-08,༼ つ ◕_◕ ༽つ MOLLY༼ つ ◕_◕ ༽つ,0.0,Neutro
Shindo989,2013-05-28,And now I want to go watch groove and listen to digweed...,0.0,Neutro
Mean_Gene_Oakland,2014-09-06,i can't seem to find molly..molly..molly..molly..molly..molly..molly..molly..molly..molly..molly..molly..molly..molly..molly..molly..molly..molly..molly..molly..molly..molly..molly..molly..molly..molly..molly..molly..molly..molly..molly..molly..molly..molly..molly..molly..molly..molly..molly..molly..molly..molly..molly..molly..molly..molly..molly..molly..molly..molly..molly..molly..molly..molly..molly..molly..molly..molly..molly..molly..,0.0,Neutro
BrotmanLoL,2013-05-13,no https://www.youtube.com/watch?v=3ZtUuHujB20,0.0,Neutro
BoringPersonAMA,2014-09-14,Guardians of the Galaxy had an *excellent* marketing team though. Everything from the trailers to the posters was hyped to the max. Ant Man has been pretty disappointing so far in that regard.,0.1875,Positivo
[eliminado],,[deleted],0.0,Neutro
summerteeth,2009-08-15,"Guardians had a good director though.

They also had one working on Ant Man but they scared him away.",0.7,Positivo
[eliminado],,Easy there Kanye,0.43333333333333335,Positivo
[eliminado],,"Batman, Superman, Spiderman, those all sound appealing based solely on the name.

Ant Man? Not so much.",0.3666666666666667,Positivo
largebrandon,2012-03-09,I had no idea Ant Man was even a super hero but i'll sure as hell go and see it.,0.41666666666666663,Positivo
pc1109,2014-05-08,"And I believe something to do with Our Idiot Brother, which I loved. Like I say, I really hope it does well!",0.04999999999999997,Positivo
[eliminado],,[removed],0.0,Neutro
FentonFerris,2012-02-29,"People like to make Tony Stark to be the Batman of the Marvel universe, but before the movies his status was more like Green Arrow. On an A List team, but not as forefront. This is partially caused by Marvel having three big teams active (Avengers, X-Men, Fantastic Four) while DC usually has one or two (JLA and maybe another, depending on the timeframe).",0.002083333333333333,Positivo
Xciv,2011-05-01,"But Guardians of the Galaxy's trailer had a certain electric energy to it. It had that *it looks good* vibe all over it. Antman's trailer doesn't give me that same feeling. I still hope it's good, but nothing in the trailer really excited me.",0.39785714285714285,Positivo
pc1109,2014-05-08,"I agree totally. Like I say, I really hope it performs. (I know nobody should bring Hitler into arguments... but...) But everyone had heard of Catwoman. Halle Berry had just won an Oscar. Just putting it out there, that they can make disasters with best intentions.",0.39999999999999997,Positivo
m0ondogy,2012-05-02,"People say this, but I knew him. He showed up more often than people give him credit. He is no A lister like batman, superman or Hulk, but he is above B list. He is in that weird area between. 

Source: I never read a comic before and have no interst in much relating to them (New movies not included), and could tell you iron man was rich and drunk before the movies.",0.05767045454545455,Positivo
Gaffelstein,2008-12-13,I knew him from marvel vs. capcom,0.0,Neutro
[eliminado],,I used to watch the cartoon all the time when I was a kid. I always remember his subterranean silo of suits for every single situation.,-0.07142857142857142,Negativo
guruscotty,,You're also describing Marlon Brando.,0.0,Neutro
Rinkydinky,2012-06-12,Ohhhhhhhhhhhh,0.0,Neutro
southern_boy,2010-07-27,He's the *emperor* at directing animations.,0.0,Neutro
thatoneguy211,2012-01-25,"And don't forget Don Bluth. Everyone always forgets Don Bluth. Land Before Time, An American Tail, All Dogs go to Heaven, Secret of NIMH, Anastasia, Titan AE, etc.",-0.2,Negativo
waylaidwanderer,2011-06-30,What agency?,0.0,Neutro
RaptorsFromSpace,2013-12-02,Backstrom was fucking horrible to work on. Made me quit working on TV shows and now I'm sticking strictly to films.,-1.0,Negativo
howdareyou,2010-02-19,Yes so great that Brad Bird is being paired with great DPs. Robert Elswit shot MI4.,0.8,Positivo
[eliminado],,"Sorry, what's a DP?",-0.5,Negativo
[eliminado],,[deleted],0.0,Neutro
Bakoro,2012-04-13,"There was an NPR interview with Lindelof that really helped me articulate why I hate him.

In the interview Lindelof talked about how when he was a kid he read ""Encyclopedia Brown"" books, but instead of reading the story and figuring out the mystery, he would skip to the back and find out the answer to the mystery. Lindelof's dad felt that was cheating so he tore the last page out of the books when he got them and never gave them back— forcing Lindelof to come to his own conclusions about what happened while never getting the actual answer.

So what Lindelof has been doing is recreating his trauma on a scale 100000x larger and then asks people to pay to subject themselves to it. 

That by itself isn't so bad, not every story needs to be wrapped up in a nice, neat, easily consumable package. It's okay to leave *some* unanswered questions. That's not what Lindelof does though. What he does is build up a decent mystery/story, and then adds, and adds, and at the point where there should be some kind of payout, he flips 90 degrees and goes in some other direction, and you never get a coherent piece of entertainment.

Lindelof isn't *totally* shit at what he does, obviously he has enough talent to have gotten where he is, but seriously, everything he's done has ended up being massively unsatisfying bullshit.

Also he's a goddamned liar. With *Lost* he swore that there was a direction and that the writers weren't just making shit up as they went along, and he said there would be a solid ending. As it turns out, *Lost* was supposed to have ended way earlier than it did and the writers were just making a bunch of unrelated shit up after they ran out of the initial material, and most of everything that happened in the show meant nothing.  

Life is already an long list of unanswered questions and letdowns, I don't need to waste my time on something that I know won't have any kind of resolution or payoff.",0.04765625000000001,Positivo
geeeeh,,Also a Lindelof fan. Didn't realize there was so much hate for him in the world.,-0.8,Negativo
robodrew,2010-09-16,"I loved LOST.  But then the last season came along, took a shit on all 6 seasons before it, and literally made me think ""man, it's like all of that emotion I'd invested into the series was for nothing."" Lindelof (moreso than Abrahms) kept saying for years that he had a bible for the show, that they weren't [spoiler](/s ""dead""), and yet we got the ending we did.

Then he wrote Cowboys and Aliens, which was utterly forgettable.  Followed that up with Prometheus which had the dumbest characters in a sci-fi movie in years (check out Red Letter Media's segment on this movie, it's great).  Then he went on to make Into Darkness which was far inferior to Star Trek 2009.

World War Z was another disappointment that was quite derivative and forgettable.  I didn't bother watching ""The Leftovers,"" but from what I heard from people who did watch it, it basically had the same problem as LOST where it was trying to be all mysterious but just kept muddying itself up with more mystery that wasn't going anywhere.

Basically, the guy writes stuff that is like the witch's red apple; it looks delicious at first but it's only after you've taken a bite that you realize it's actually poison.",0.07500000000000001,Positivo
friendofhumanity,2014-04-02,"Merci, Madame Knightley.",0.0,Neutro
Grandpa_Edd,2012-06-30,"For the Walloons yes, the Flemish will most likely still use the English title.",0.16666666666666666,Positivo
PancakePanic,2012-07-28,We're not french!,0.0,Neutro
MiNiMaLHaDeZz,2013-01-14,What about in Dutch yo,0.0,Neutro
keithmac20,2013-07-26,Stupid sexy northern part of Belgium,-0.14999999999999997,Negativo
bigblueoni,2012-02-10,Deeply. And I'm sure in a few months someone on /r/bestof or /r/movies will link it when it's inevitably right.,0.1464285714285714,Positivo
[eliminado],,metacynics,0.0,Neutro
[eliminado],,"I find a lot of the 'opiate of the masses' stuff is a big presumptuous and highly arrogant.  Like ""I'm above your petty mass entertainment, and can see the world for what it really is"" sort of thing.",0.09,Positivo
bigblueoni,2012-02-10,"*Hero with a Thousand Faces*, Joseph Campbell",0.0,Neutro
Rcfan0902,2011-08-15,"With this, haunted mansion and pirates, probably.",0.0,Neutro
NikkoE82,2012-02-28,They almost made a movie about the entire Magic Kingdom along the lines of Night at the Museum.,0.25,Positivo
Travis100,2012-03-29,"I believe this is actually one of their new focuses. They want to shift away from making rides about movies, and instead make movies about their rides.

I remember reading that Big Thunder Mountain Railroad will also become a move at some point, but don't quote me on it.",0.04545454545454545,Positivo
not_carlos,2011-11-04,Yeah about that. Look up 3rd Man on the Mountain.,0.0,Neutro
Cranyx,2012-06-26,"Alright, alright, alright.",0.0,Neutro
ScottyXP,2013-03-11,Did they make LoZ on netflix yet? ( ͡o ͜ʖ ͡o),0.0,Neutro
InShortSight,2013-04-09,IMPOSSIBLE!!!,-1.0,Negativo
[eliminado],,[deleted],0.0,Neutro
dibsODDJOB,2010-08-31,They still sell tons of Mickey and Minney crap. And he's everywhere at the parks. But why sell the same stuff when you can invent new characters to sell to people and create new reasons for them to come to your parks?,-0.13181818181818183,Negativo
[eliminado],,[deleted],0.0,Neutro
expensivepens,2013-05-07,And do acid,0.0,Neutro
unic0rnpantz,2013-05-03,Heaven Scent!,0.0,Neutro
flexzone,2014-10-29,🔥🔥🔥,0.0,Neutro
I_need_time_to_think,2012-05-27,"Isn't it out in July? They should probably hurry up release another, more exciting, trailer soon. Though I'd imagine it'll be hard when Age of Ultron is stealing all of the buzz and is out just 2 months before. 

They probably shouldn't have them released so close to each other.",0.09583333333333333,Positivo
[eliminado],,[deleted],0.0,Neutro
ahandfulofbirds,2014-10-19,"To be real, Spider-Man and Ant-Man are incredibly similar in their name appeal. Neither sounds particularly good, we just know heaps about Spider-Man already.",0.3,Positivo
reversewolverine,2013-09-04,"There were only two season of party down, so every season is one of the best (though I agree the first is the best).",0.4188888888888889,Positivo
Astrosomnia,2013-08-14,"It can be a bit hit and miss, but no other show makes me laugh so joyfully and genuinely as HIMYM at its best.",0.440625,Positivo
Gars0n,2012-04-02,Is that really true? In the Civil War arc Iron Man and Captain America were pitched as the heads of their factions and put on equal footing in terms of respect.,0.175,Positivo
[eliminado],,"JLA and Teen Titans, really.",0.1,Positivo
3p1cw1n,2012-10-25,"To be fair, Antman doesn't yet have an official full trailer, just a teaser trailer.",0.5249999999999999,Positivo
Xciv,2011-05-01,[I knew him from this cartoon](https://www.youtube.com/watch?v=JBbnT-cIDVM).,0.0,Neutro
therealpdrake,2008-09-25,chuck jones,0.0,Neutro
[eliminado],,[removed],0.0,Neutro
x_paranoidandriod_x,2015-03-06,"Deer God, you've gone too far.",0.1,Positivo
[eliminado],,BCF Casting and Hollywood North Extras,0.0,Neutro
moistbread,2012-11-03,What about it was horrible may I ask?,-1.0,Negativo
Lizard182,2013-07-22,Director of photography or a cinematographer.,0.0,Neutro
CommissionerValchek,2012-01-21,"While I totally agree with the sentiment, I'd argue his third acts are about as good as they can be considering the lack of logic in the acts preceding them. He throws in whatever seems cool or interesting at a given moment, with no planning as to how those things coexist or build to anything, let alone stem from a common coherent explanation. This makes the beginning and middle of his stories *seem* like they're good in that moment, but they lack the basic structural necessities to allow a decent climax and resolution, no matter who's writing them.",0.23787878787878783,Positivo
archiesteel,2010-08-29,I love this subreddit.,0.5,Positivo
Madjack66,2014-12-02,"I had no idea about the father tearing out little Lindelof's conclusion pages. That explains so much about his writing.

I still can't forgive him for Prometheus though.",0.0062500000000000056,Positivo
futurespacecadet,,Holy shit this was as thorough as it was poignant. A++,-0.1,Negativo
nintendo_girl,2015-02-12,"Almost every show is made up as it goes along. He might not have been lying when he said the writers were writing towards a redemption ending with them being dead. I don't get people's hang up expecting every show/film to be written out. That's not realistic with how the TV industry works (the amount of time they have). Saying your story has a direction being worked towards could mean you have an overall concept you are working towards. I guarantee the bulk of shows do not have the entire story planned out (maybe in concept and overall ideas, but not episode to episode or season to season). I agree with the rest of your post about Lindelof but would add most of his writing was a collaborative affair and some of best episodes of LOST were written by him and The Leftovers isn't that bad.

But this obsession people have with TV shows being written all the way out and pre-planned for is bizarre as hell.",0.06041666666666669,Positivo
Keira-Knightley,2013-04-24,"Mais de rien mon cher, je vous en prie.",0.0,Neutro
BenCelotil,2010-09-02,"""I'm not a bloody little frog, I'm a bloody little Belgian!"" - Hercule Poirot.",-0.20546875,Negativo
Keira-Knightley,2013-04-24,"Sorry sorry ! I have two friend from belgium who speak french, but I know there is actually three official language, including Dutch and German !",-0.225,Negativo
drinks_antifreeze,2014-09-17,Hi diddley ho Belgierinos,0.0,Neutro
ionyx,2012-04-30,sick reference bro,-0.7142857142857143,Negativo
wadech,2011-06-03,I have some bad news. I saw an early screening of this and you're pretty far off.,-0.062499999999999965,Negativo
[eliminado],,[deleted],0.0,Neutro
Tyranid457,2012-02-20,"I hope so. Maybe it's just my mind ""filling in the blanks"", but I would love the movie that you described.",0.5,Positivo
Dioskilos,2011-08-11,painfully true.,0.35,Positivo
Creedelback,2009-12-18,I can't wait till they make the movie about the popcorn kiosk on Main Street.,0.16666666666666666,Positivo
risp_ftw,2010-10-26,I don't mind,0.0,Neutro
[eliminado],,"There's a book about this, it's called Kingdom Keepers. One for each park, if I'm not mistaken.",0.0,Neutro
Tainlorr,2011-06-28,Whoa!,0.0,Neutro
[eliminado],,"Patience, Scotty!",0.0,Neutro
lollerbladder,2012-11-07,"holy crap, those were both him too? geebus

if you can't tell, i don't usually pay attention to directors haha",-0.2833333333333334,Negativo
friendofhumanity,2014-04-02,"That's bad logic because we are talking about movies, and while they may still sell apparel at the parks, they aren't selling Mickey movies right now. Yes they need to always keep an eye out for new things to sell, but they aren't gaining anything if they aren't selling Mickey in the theaters. 

And this whole line of arguments misses what we should be talking about anyways: Mickey is an important figure in cinema history, and shouldn't languish even if he isn't selling. Disney should care about Mickey because Mickey is a great character, with a great history, and that deserves more than just being a theme park attraction.",0.3027597402597403,Positivo
[eliminado],,[(ง ͡卐 ͜ʖ ͡卐)ง](http://i.imgur.com/DqMf6yL.gif),0.0,Neutro
BoringPersonAMA,2014-09-14,I think AoU will be a pretty effective trailer for AntMan.,0.425,Positivo
acog,2009-07-20,"> They should probably hurry up release another, more exciting, trailer soon.

[Paul Rudd just announced this trailer today](https://www.youtube.com/watch?v=XGQevaXj3tQ).",0.4,Positivo
[eliminado],,[deleted],0.0,Neutro
[eliminado],,"If it's a risk, how can you be sure it will make money?",0.5,Positivo
Levitlame,2012-04-04,"Thor wasn't well known outside comics before his movie either, though his name in Norse mythology is well known. the first Thor made about $181 mil. The second 205.

I think it's reasonable to say Antman can go either way.",0.1125,Positivo
[eliminado],,"Going off name alone, not acknowledging brand recognition, Spiderman is catchy. Spiders are interesting and threatening.

When you combine the name and costume, you get a character that should be hard to fuck up. Ant-Man is just an embarrassing name all over.",-0.0638888888888889,Negativo
Cranyx,2012-06-26,"""name appeal"" does not literally mean how appealing the name sounds; it's essentially name recognition. Spider-Man is one of the most famous comic characters of all time, arguably beaten by only Batman and Superman.",0.20535714285714285,Positivo
[eliminado],,[deleted],0.0,Neutro
The13thzodiac,2013-03-20,Only Tony could realistically be at the head of the pro-government faction.,0.0,Neutro
[eliminado],,And it was really the first time in awhile that Iron Man was at the front of anything.,0.225,Positivo
AdrienI,2012-05-30,"Of course in the comics Iron Man has a big impact, same for the MCU now. But before 2008, a majority of people only knew the X-Men, the Fantastic 4 and Spider-Man.

And as /u/PlayMp1 pointed out, Hulk. (And Captain America in the US).",0.1,Positivo
DinnerBlasterX,2012-04-25,To be fair fucking everything about Antman is a massive cocktease currently,0.024999999999999994,Positivo
Gonzzzo,2010-12-13,"Same here...I feel like a lot of 90s kids got a lot of exposure to Marvel characters through the Saturday-morning cartoons

I never read anything besides Spiderman & Ironman when I was growing up (I didn't read very often), but I still know a lot of the X-Men characters & major story-arcs just because I thought the cartoon was so good.",0.24062499999999998,Positivo
-OMGZOMBIES-,2013-09-01,They should have kept his super chiseled abs in the live action movie.,0.1898989898989899,Positivo
Sprinkletinkler,2014-01-27,Pioneer??,0.0,Neutro
harry_manbach,2012-01-09,"nope, chuck testa.",0.0,Neutro
RaptorsFromSpace,2013-12-02,It was just really chaotic. I worked in locations and the rest of the crew didn't seem to give a shit about the places we were shooting in. We shot in a very expensive mansion once and one of the cast sat on this glass table that we has specifically bubble wrapped and set to the side and it shattered.,-0.21666666666666667,Negativo
miggitymikeb,,That's accurate.,0.4000000000000001,Positivo
robodrew,2010-09-16,"But the good ones are planned out, at least in a very basic skeleton-like way that helps to guide everything else.  It's called an outline.",0.13333333333333333,Positivo
flippinecktucker,2013-05-20,"You're right to say that's how it is. You're wrong to say that the desire to have it otherwise is bizarre. The best dramas are written in full, no question.",0.3071428571428571,Positivo
friendofhumanity,2014-04-02,Vous etes extremement gentille madame. Aussi j'adore vos films. Mais je n'avais pas l'idée que vous etes belge! Et vous venez de la bonne moitié aussi!,0.0,Neutro
makesyougohmmm,2013-07-06,It would all have been German if it wasn't for you meddling kids.,0.0,Neutro
RemindMeBot,2014-04-27,"Messaging you on [**2015-05-22 21:38:15 UTC**](http://www.wolframalpha.com/input/?i=2015-05-22 21:38:15 UTC To Local Time) to remind you of [**this comment.**](http://www.reddit.com/r/movies/comments/2y5hmv/new_tomorrowland_poster/cp6nvan)

[**CLICK THIS LINK**](http://www.reddit.com/message/compose/?to=RemindMeBot&subject=Reminder&message=[http://www.reddit.com/r/movies/comments/2y5hmv/new_tomorrowland_poster/cp6nvan]%0A%0ARemindMe!  May 22, 2015) to send a PM to also be reminded and to reduce spam.

_____

[^([FAQs])](http://www.reddit.com/r/RemindMeBot/comments/24duzp/remindmebot_info/) ^| [^([Custom Reminder])](http://www.reddit.com/message/compose/?to=RemindMeBot&subject=Reminder&message=[LINK INSIDE SQUARE BRACKETS else default to FAQs]%0A%0ANOTE: Don't forget to add the time options after the command.%0A%0ARemindMe!) ^| [^([Feedback])](http://www.reddit.com/message/compose/?to=RemindMeBotWrangler&subject=Feedback) ^| [^([Code])](https://github.com/SIlver--/remindmebot-reddit)",0.0,Neutro
Kyle772,2012-01-10,Fuck that I need a movie about the turkey leg kiosk.,-0.4,Negativo
shazang,2011-07-22,They're EXTREMELY decent.,0.16666666666666666,Positivo
TaylorDangerTorres,2013-05-31,"Great series.  I did some of the Authors YouTube videos for his page.  Super nice guy.  If you're a Disney Fan at all, do yourself a favor and read the series.  ""The Kingdom Keepers""  it's written by Ridley Pearson.",0.5777777777777778,Positivo
gamelizard,2012-03-23,they are currently running newish mickey cartoons on their tv channel.,0.0,Neutro
thefatrabitt,2014-03-05,ಠ_ರೃ mmm quite.,0.0,Neutro
Hatch4815162342,2013-05-21,Best thing I've seen online today lol,0.9,Positivo
[eliminado],,"That's Mac and Me, isn't it.",0.0,Neutro
showers_with_grandpa,,"I knew, and I clicked it anyway.",0.0,Neutro
[eliminado],,[deleted],0.0,Neutro
[eliminado],,[deleted],0.0,Neutro
