Usuario,Fecha_Creación,Comentario,Polaridad,Sentimiento
Deadalious,2010-01-09,"It's horrible, a lot of people travel quite far for Tomorrowland and even if they do somehow end up cancelling and rebooking for next year it's a tremendous amount of wasted money for everyone invovled.

  
Stinks all round.",-0.22380952380952382,Negativo
deadasdollseyes,2023-12-23,What about the stage took 2 years to build?,0.0,Neutro
supercardiac,2021-04-04,"Not likely I imagine, there's still over a dozen stages and hundreds of other artists performances still going ahead even if they can't solve this issue in time.",-0.0625,Negativo
upupdwndwnlftrght,2023-06-08,That will have to wait till tomorrow.,0.0,Neutro
Limonade6,2020-06-01,Just read the news. Seems like the festival will continue but without a main stage. I wonder how  they will manage that.....,0.16666666666666666,Positivo
itsavibe-,2017-09-24,Accurate,0.4000000000000001,Positivo
CANNAAmann,2024-08-04,Why is everyone so dormer pilled? It's not too late to make a difference if you really think the world is ending.,-0.04999999999999999,Negativo
GwerigTheTroll,2019-10-29,Foreboding as hell,0.0,Neutro
NestedForLoops,2016-01-06,You're not my supervisor!,0.0,Neutro
MagmaForce_3400_2nd,2022-03-30,Boom means tree in Dutch fyi,0.0,Neutro
CzechHorns,2024-08-29,Damn flat earthers,-0.025,Negativo
Nice_Name_3168,2021-01-14,the 2012 aftermovie was insanely good,0.7,Positivo
verticon1234,2014-09-11,Holy crap I was there for that,-0.8,Negativo
JobItchy9815,2020-11-09,I went in 2017. It was so epic. Dimitri Vegas & Like Mike were on the main stage,0.13333333333333333,Positivo
Odd_Status3367,2025-05-19,"I adore comments like this. Well meaning but still wanting one's truth to be told.

""Sucks big time. Wouldn't be caught dead near this shit but still sucks big time.""",-0.1285714285714286,Negativo
Yesiamaduck,2013-02-27,It's still going ahead apparently. More than one stage. Wouldnt surprise me of they hire a generic outdoor stage,0.25,Positivo
Safe-Promotion-2955,2021-08-09,"They've had problems before due to weather and have done refunds, so they must have insurance. I don't think anyone would run a system that big without it.",-0.0625,Negativo
bilboswagginsIII,2018-07-31,"Yeah, the Tomorrowland stage",0.0,Neutro
Paizzu,2010-12-18,*Trainwreck: Tomorrowland* dropping on Netflix in 3... 2...,0.0,Neutro
Nirvanet,2025-03-29,"It’s 2 years of preparation, and they started to build it in May. It's ́not permanent, usually it's a park.",-0.25,Negativo
Neither_Pirate5903,2020-08-28,This is a multi MILLION dollar stage and one of the biggest music festivals in the world.,0.0,Neutro
HoldEm__FoldEm,2024-11-21,"So, literally any modern home in the U.S.?

Our modern houses burn up in minutes.",0.2,Positivo
GalacticMe99,2023-10-10,They are just waiting for the local authorities to shut it down so that the insurance has no ground to cancel their claim lol,0.21481481481481482,Positivo
Dirtymeatbag,2014-05-30,"Mostly wood, styrofoam and glue. Local government sent out alert messages to people living nearby that the smoke could cause minor irritation but isn't toxic.",0.15,Positivo
GalacticMe99,2023-10-10,Music festival in Belgium with 400.000 attendants from all over the world.,0.0,Neutro
wearetheawesomes2,2020-09-10,"Dw about that part, i work for insurance and the company had a fair share of festivals in the portfolio (ofc canceled contract due to the amounts paid) 

Usually festival contracts are divided to 3+ and each insurance company has a percentage they will pay for. The the lead insurer takes up the bulk with 25-40% and smaller ones take 7-12% depending on the risk they are willing to accept. Everything is categorised from damages like these or (partial) cancelation due to weather. 

They pay big bucks for the right coverage (tho insurance companies lose a lot on these kinda policies imo) 

So dw, next year will happen without a doubt :)",0.10324675324675324,Positivo
Soggy-Alps5924,2021-07-02,Fire Festival fr this time,0.0,Neutro
ron_balboa,2021-02-12,"They can keep the burned frame, and make it an post-apocolyptic theme. Or something like a mad Max desert theme",-0.625,Negativo
VeryMuchDutch102,,"> They say they are ""figuring out"" what they are going to use for a main stage.
> 
> A festival this big cannot cancel this close. At the very least they will just play music on the ground 🤣🤣

A lot van be done with little time... It won't be as spectaculair as it was planned... But it won't be boring either",-0.2821666666666667,Negativo
discodropper,2018-04-11,So was that a successful test or not?,0.75,Positivo
svennon89,2018-07-23,"Where did u get that info? The fire started 3 hours ago, i live very close to the festival and i dont have that information yet

Edit: never mind, i found that they assumed it was during fireworktesting",0.16818181818181818,Positivo
No_Influence6605,2025-01-17,"So freaking glad they thought of that.. me, I would have thought I would have prepared for everything.. so glad they thought of it.. thanks for mentioning that.",0.39999999999999997,Positivo
AlphaNoodlz,2022-01-29,I guess they blew up their test,0.0,Neutro
DracZ_SG,2014-08-05,"https://variety.com/2025/music/news/tomorrowland-main-stage-fire-festival-will-continue-1236463093/

Nope lol.",0.8,Positivo
MyDudeX,2024-08-31,Pastland,0.0,Neutro
FractalCircuit,2025-05-02,Yesterdayland,0.0,Neutro
i_dead-shot,2025-04-04,Tommorowland...*Neverlands* now,0.0,Neutro
cardnialsyn,2016-09-06,When will then become now?,0.0,Neutro
BeowulfShaeffer,2008-09-11,When will it be now?,0.0,Neutro
EngelNUL,2020-01-23,When will then be now?,0.0,Neutro
arkgrotto,2012-06-06,This is now now,0.0,Neutro
blueipDriver,2025-05-09,"We're in now, Now",0.0,Neutro
KhaotikDevil,2019-01-24,But when will then be now?,0.0,Neutro
1cec0ld,2012-05-10,Burning stage festival,0.0,Neutro
e136,2018-07-29,And hopefully they'll learn and possibly have procedures or even regulation to prevent this in the future.,0.0,Neutro
Boneyg001,2015-06-23,not really. These people are professionals and have run events before. Fyre was a scam and had no idea how to set up an event. these people likely have talent and budget to get something professional together even if short on time,0.0,Neutro
pixeldust6,2017-04-02,I see a fire and I see a festival so...,0.0,Neutro
nyaaaa,2012-02-11,"Not having one stage(set design, the stage can be opened without) vs not having a festival. Small diff",-0.25,Negativo
Johannes_Keppler,2022-06-09,"Pronounced ""b'ohm"" - it means tree.

Burning like a Christmas tree, in this case.",0.0,Neutro
Potential_Anxiety_76,2020-10-07,"Oh gods, that’s gorgeous. I didn’t realise the loss would be this tragic.",-0.025000000000000022,Negativo
Samzkeeh,2016-09-13,"My math comes out at 75%, am I missing something?",-0.2,Negativo
grimsb,2010-12-09,I’m glad I’m not the only one 😅,0.25,Positivo
Past_Sky_4997,2025-05-05,"From the video, it does look like at least 7.5% of the set was destroyed indeed.",-0.3,Negativo
Turdburp,2023-02-22,"Only if you use a definition of the word that hasn't been common since the 17th century.

[https://www.merriam-webster.com/dictionary/decimate](https://www.merriam-webster.com/dictionary/decimate)",-0.15,Negativo
Rocify,2021-01-05,"I’m sorry you’re getting roasted for trying to include a Roman Empire reference in your math joke about a devastating fire. 

Really I just wanted to write that sentence because it’s so absurd.",-0.45,Negativo
JollyOakTree,2025-05-04,this was a good joke but omg can some people in the replies be pedantic,0.7,Positivo
BafflingHalfling,2022-05-08,Yeah... i was 40 something when I learned that decimated meant ×0.9. For the longest time I assumed it meant ×0.1,0.0,Neutro
Last-Atmosphere2439,2025-01-23,"What's funny is people are still being pedantic and insisting that a modern English word must only be used in the exact same context it was (allegedly) used in Ancient Rome.

Look up decimated in ANY English dictionary and see if the definition focuses on 10% or on, you know, the common meaning and usage of this word.",0.03333333333333333,Positivo
Yeet-Retreat1,2022-05-01,"""This record is in honour of George Floyd"" then starts raving madly.",-0.625,Negativo
Eat--The--Rich--,2025-05-13,"Its one of the biggest music festivals in the world and it features a ton of quality artists, not just one dude you don't like.",0.0,Neutro
Neinstein14,2024-05-05,You mean featuring artists *and* David Guetta,-0.3125,Negativo
cjalderman,2016-03-12,Yeah some people have different interests than others,0.0,Neutro
LatverianCyrus,2013-12-20,"The festival, or the Disney thing?

Because the answer is yes to both.",0.0,Neutro
Longjumping_Bar_7457,2021-03-14,First time I heard about outside of the Disneyland/ world context,0.125,Positivo
Fen_,2007-11-06,"I'm from the U.S. and had never heard of the dance festival.  Even seeing the video, my first reaction was ""I don't remember there being a giant stage like this in that section of the park"".",0.125,Positivo
lawrence1024,2014-07-30,LIV Nightclub Miami has a system that periodically shoots a burst of cold air into the dancefloor. It was awesome!,0.2,Positivo
ScoobyPwnsOnU,2015-09-13,Feel like if anyone would be in favor of drone shows over fireworks it'd be the electronic music crowd,0.0,Neutro
LiterallyKesha,2012-03-20,Why not both? And a good fireworks show is seriously something else.,0.18333333333333332,Positivo
TJ-Detweiler-,2024-11-01,"Omg fire!!🤯 I’m sweating balls, on drugs, squeezed in with tens of thousands of people and you’re shooting fire at me? Spray me with a hose and give me a light show get the fire out of here.",0.4,Positivo
RangerRekt,2016-08-05,"Yeah, they couldn’t do pyro at Lost Lands last year because of the drought and it definitely felt like something was missing. I <3 20 foot tall open flames.",0.16,Positivo
amatorsanguinis,2014-03-23,That’s admirable.  In the US it would’ve been a bloodbath.,0.0,Neutro
Salander27,2012-01-06,"They're still holding the festival, just without a main stage. There are 14 other stages.",0.02083333333333333,Positivo
stellaislekker,2015-03-16,The stage itself. Tomorrowland famously has an over the top looking mainstage that takes 2 years to make and 2 months to set up onsite. This years edition had 2600 m³ of styrofoam in it.,0.5,Positivo
Sc_e1,2020-05-03,Depends. The main stage area takes loads of the 400k capacity. so removing that will overfill the area really quickly.,0.25,Positivo
Critical-General-659,2022-01-12,Not likely. That's a toxic environment now.,0.0,Neutro
Free_Pace_2098,2024-02-21,"Partial refund if they can't relocate the mainstage artists I imagine


Source: I go to festivals in a very isolated city that artists love to pull out of at the last minute. The land of the partial refund.",0.1,Positivo
HighFiveWorld,2022-04-04,You really landed that joke.,0.2,Positivo
JustBennyLenny,2024-06-14,"Would that suffice? they paid in full, entire full show, right?",0.2464285714285714,Positivo
crystal_castle00,2019-06-29,Are you trying to get ants ?,0.0,Neutro
Neilp187,2019-04-29,Same soo good,0.35,Positivo
IrishPigs,2012-02-14,It's gonna be tough to get the charred remains out of there and replace it with new stuff. I work in live events and no way in hell would I touch any of the damaged gear before people went through and inspected what was actually damaged and what can come down safely.,0.038047138047138045,Positivo
Dubbayoo,2015-11-15,What is dw?,0.0,Neutro
saggywitchtits,2018-07-25,"As cool as that would be there would have to be many tests to see how structurally sound it still is, and that will take longer than a day.",0.4166666666666667,Positivo
Martlet92,2024-04-28,That would be so cool!!,0.546875,Positivo
CtheKiller,2014-12-03,"I haven't been to Tomorrowland, but usually festivals of this size have 5-6 stages ongoing at once. This should only be one of the stages.",-0.125,Negativo
shredditorburnit,2023-11-02,"Very, look at how many lives it saved Vs not testing it before the event.",0.35,Positivo
AndrewBorg1126,2018-01-29,"Test event succeeded, setup being tested did not pass the test.

An unsuccessful test event would be something preventing the test from taking place, or preventing the result of the test from being known, or preventing the test from being representative.

For instance, if the test were intrrupted by a thunderstorm and lightning struck the fireworks, that would be an unsuccessful test event.

If, during the test, the stage and fireworks are configured differently than they would be in the festival, then regardless of the test's outcome, the test is unsuccessful because it is not representative.

The goal of the test was to determine if the setup was safe. The test achieved this goal by determining that it was not safe.",0.08333333333333333,Positivo
zasrgerg-8999,2024-03-12,Fire? Works!,0.0,Neutro
theWindAtMyBack,2025-04-14,I mean the fire IS working......\*shrug\*,-0.3125,Negativo
Party_Organization80,2024-10-06,The fire works.,0.0,Neutro
TheDarkWave,2015-01-05,Task failed successfully.,0.125,Positivo
Deputy_Scrub,2019-01-21,"Depends on who's playing I guess.

Rammstein might say this was a successful test.",0.75,Positivo
Restaldte,2024-12-31,Task failed successfully,0.125,Positivo
Wufflekins,2023-03-17,Test Failed Successfully,0.125,Positivo
Grenaidzo,2021-08-05,"I can see the fireworks in the video, so yeah, all good.",0.7,Positivo
Watpotfaa,2024-05-17,It exceeded their expectations.,0.0,Neutro
Carlyone,2016-07-05,"Well, the fire works.",0.0,Neutro
Stannoth,2021-02-13,"Press conference at 20h30. Brief notes: fire started while testing, none injured, small fire in nearby woods, mainstage completely destroyed, festival continues as they prepare to host the campers.",-0.049999999999999996,Negativo
Concrete__Blonde,2021-04-05,Two separate incidents. They’re referencing the fire that occurred during the actual show.,0.0,Neutro
Welcome440,2024-01-09,Now there will be a 🔥 Fire Festival that is good.,0.7,Positivo
jaknonymous,2022-03-22,HasBeenLand,0.0,Neutro
sethcera,2008-11-25,Maybe the best scene of the movie,1.0,Positivo
psychadellicatessent,2017-11-14,"Right **NOW** *snaps fingers* 
.... Oops ya missed it, let's try that again...",0.2857142857142857,Positivo
ocularis73,2015-12-13,Soon,0.0,Neutro
spiral_out462,2018-11-28,Soon!,0.0,Neutro
CigAddict,2014-04-09,The test is the procedure to prevent this from happening (during the concert),0.0,Neutro
TheCourtJester72,2018-05-14,Are they running events that get burned to the ground two days before show? There is not training to manage a random and spontaneous disaster like this.,0.04999999999999999,Positivo
UrMomIsVeryBig,2021-10-27,The whole setup for the stage took months....,0.2,Positivo
xpepcax,2017-07-05,They only needed 2 year to prepare that stage. I guess they can fix it in 2 days.,0.0,Neutro
IrishPigs,2012-02-14,"Problem is you can't trust any of that gear for rigging until it's been inspected. Sure you don't need a set, but you certainly need a roof with a significant rigging capacity for all the Lx, Vx, and Ax out there.",0.36309523809523814,Positivo
cuddlesnuggler,2014-07-28,"Decimation means ""to eliminate 1/10 of something""",0.0,Neutro
fishtankm29,2024-07-18,A joke about how decimate used to mean taking 1/10th of something. (Deca = ten),-0.15625,Negativo
Mirar,2008-10-29,"[https://en.wikipedia.org/wiki/Decimation\_(punishment)](https://en.wikipedia.org/wiki/Decimation_(punishment))

Literally from ""destruction of a tenth""",0.0,Neutro
clinkzs,2016-03-24,"75% ""decimated"", as in ""divided by ten"", leaves us at 7.5% in most western world mathematics",0.16666666666666666,Positivo
AspiringChildProdigy,2020-11-07,"Decimated means to decrease by a factor of ~~10~~ (Edit: 10%. Effective multi-tasking is a myth. 😅)

Their sentence basically said that 10% of three quarters of the stage was destroyed, or 7.5%.",0.6,Positivo
notworldauthor,2024-05-05,Don't you dare take my pedantry away from me!,0.0,Neutro
dmdjjj,2020-06-05,It’s TomorrowLand not 17thCenturyLand after all,0.0,Neutro
JerkfaceMcDouche,2015-11-11,"The part of my brain that knows you’re right is at war with the stubborn, pedantic part of my brain that refuses the new definition for no good reason.",0.024025974025974024,Positivo
epitoma,2013-12-04,I will forfeit 1/10 of my life on this hill.,0.0,Neutro
greypusheencat,2024-06-19,"never forget, and “shoutout to his family” i saw that live and it blew my mind lol",0.4681818181818182,Positivo
Ritalin5,2025-05-14,*plays crazy frog*,-0.6,Negativo
ATraffyatLaw,2016-03-04,\*bursts into flames\*,0.0,Neutro
silver-orange,2019-02-06,I didn't say a single word about my opinion of guetta?   Just listed him as one of the names most widely recognizable to the sort of people who might not have ever heard of tommorrowland.,0.2261904761904762,Positivo
Lich_Apologist,2025-05-01,Loving that tomorrowland is just some festival to people.  Like I tend to be in a different stream then the European festivals but Tomorrowland is iconic on a different level then most festivals.,0.26666666666666666,Positivo
MouthFartWankMotion,2011-12-08,"Calm down buddy, they didn't say anything about their opinion of him. Psychotic behavior.",-0.11851851851851851,Negativo
NixiePixie916,2018-10-18,"Oh man, imagine the drone lights pulsing with the music, that would be an experience.",0.0,Neutro
Kamikaze_Ninja_,2019-01-08,"Eh, once you’ve seen a few, you’ve seen them all. Obviously just my opinion, but I feel like I’ve aged out of fireworks. I just don’t care about them anymore.",-0.10000000000000002,Negativo
Waterflowstech,2020-02-13,"god damn right, not to mention fire works and CO2 cannons tend to be so damn loud they ruin all drops. Luckily most of the mainstage Tomorrowland music is immune to being ruined.",0.29523809523809524,Positivo
Safe-Promotion-2955,2021-08-09,"Double admirable when you consider it's in the middle of Europe with people attending from all over the world, so there'd be some confusion with so many languages going around, too.",0.16666666666666666,Positivo
winslowpete,2016-04-16,"It’s about a 70,000 to 90,000 capacity per day but the point still stands

It will be very crowded at the small stages",-0.024999999999999994,Negativo
yanan,2011-02-15,tomorrowland is nowhere near 400k capacity.  That's over the course of the entire festival.,0.05,Positivo
41942319,2020-04-22,"News says they're looking at options to still have the acts scheduled for main stage performing. Might just do it with a basic stage, which is a shame because the Tomorrowland main stage always looks fucking awesome.",0.3333333333333333,Positivo
tyingnoose,2021-04-19,Dance willingly,0.25,Positivo
ResolveSuitable,2020-10-04,Don't worry,0.0,Neutro
laseluuu,2016-06-04,"why tf do new festivals need so many fireworks and stupid CGI with pre-recorded sets anyway?

gimme a real DJ with mistakes and chance taking - its not like actual mixing is that high of a bar to set, is it?

who cares about sodding fireworks

  
and if i see another robot cat firing lasers to dubstep i'll probably just keel over",0.03272727272727274,Positivo
WeeboSupremo,2016-09-20,"Back in the good old days, you’d have that be a 70+ casualty event and that made the event special. 

Thanks Obama.",0.2714285714285714,Positivo
mrokraj,2018-06-25,"You actually make an interesting philosophical question: If the tested thing malfunctions during testing but by doing that it fulfils the purpose of testing, was the test successful or not?",0.3125,Positivo
Money4Nothing2000,2018-10-05,This guy tests.,0.0,Neutro
cowlinator,2014-12-18,"A very unsuccessful test event would be the test finding it to be safe, when it is not. It then gets deployed and people die.",0.35,Positivo
WayneDwade,2013-03-21,Lol how are they going to do a festival without a main stage? Sounds like it will be a complete shit show,0.21666666666666667,Positivo
AruVade,2023-05-18,Fyre festival,0.0,Neutro
IBVVDH,2019-01-30,"most of the experience with events that size is dealing with unforeseen bullshit. 
foundation still intact? can we replace what we need on time?",0.5,Positivo
ethicalhumanbeing,2021-04-09,I agree. If they pull this off I’m gonna be very surprised.,0.13,Positivo
uwuowo6510,2022-06-09,2 years,0.0,Neutro
UnpopularCrayon,2016-09-17,"That is one definition of it.  The other definition is to ""kill, remove or destroy.""",-0.1625,Negativo
porkchop_d_clown,2007-01-26,"2,000 years ago, sure. But it hasn’t meant that in a very long time.",0.2175,Positivo
PretentiousMouthfeel,2024-11-28,"> Decimation means ""to eliminate 1/10 of something""

That's an outdated, historical definition.",-0.20000000000000004,Negativo
PlayNicePlayCrazy,2023-09-23,"That is only one meaning.   It actually refers to killing one out of every 10 soldiers I believe.


Went to three different dictionaries and each specifically mentioned as one of the definitions killing one out of ten soldiers or men.    Not as an example but as one of the actual definitions.

Now maybe I should have looked up more examples but the three I did were very specific.

Sorry that it seems to bother people.",0.0,Neutro
DargonFeet,2021-02-04,And deci = one tenth,0.0,Neutro
[eliminado],,[deleted],0.0,Neutro
CosmicJ,2012-09-08,"Decreasing by a factor of 10, and removing one tenth (the actual definition of decimate), are vastly different things. The inverse of each other, in fact. If we are going to continue this silly train of pedantry.",-0.15625,Negativo
AvidCyclist250,2023-10-12,"no. ""to remove a tenth""",0.0,Neutro
Trollifix,2013-11-06,"When ""the new"" is 400 years old, I think it might be time to come around, brother! :)",0.2537878787878788,Positivo
rishado,2012-08-05,"dont forget the sample of MLK's ""I have a dream"" right before the drop",0.2857142857142857,Positivo
PiratesFan1429,2021-11-16,Dude is projecting hardcore lol,0.8,Positivo
Secure-Relation-86,2024-06-30,"Don't try to cover it up now, you clearly hate his guts",-0.8,Negativo
Lich_Apologist,2025-05-01,Also basically the Nickelback of dance music. You just stepped on a landmine there sorry.,-0.5,Negativo
Nightmare_Fart,2017-07-07,"I'm not at all into festivals, but Tomorrowland is so well known in Europe, I have never not associated it with festivals. Also, Disneyland Paris doesn't have a Tomorrowland, so most people in Europe would honestly have no idea that it's also something that could be associated with Disney.",0.55,Positivo
stammie,2013-12-23,Ummmm that’s not a new festival and at this point if Tomorrowland didn’t have their over the top fireworks people would lose their minds. I remember hearing about Tomorrowland when I was a senior in high school in 2013. It was over the top then. I’d imagine they are one of the single largest fireworks purchasers at this point in time.,0.20407792207792208,Positivo
DoctorNoname98,2014-08-11,"> gimme a real DJ with mistakes and chance taking

It's not like that doesn't exist anymore, go see a local DJ or something.  People going to these festivals aren't there for that, they are there for the big show and experience",0.06666666666666667,Positivo
alphazero925,2024-11-07,"Well first off, Tomorrowland is 20 years old. Unless you're 150, you don't get to call that new. Secondly, those still exist. You can go if you like. Those are generally the kind of festivals I enjoy as well, but some people like the spectacle of these massive festivals like Tomorrowland and EDC. So just, like, let them enjoy what they're gonna enjoy.",0.2336363636363636,Positivo
Stocksandmemes69,2021-11-29,Let people enjoy what they enjoy.,0.4,Positivo
kylewhatever,2016-11-02,"Drone shows are the future. Seeing them at Lost Lands last year was one of the craziest things I have ever seen in my life. That was one of the first ""holy shit, this is the future"" moments I have had in a long time",-2.3129646346357427e-18,Negativo
Moosplauze,2017-02-11,"I care about pyrotechnic, lasers, smoke, hell even soap bubbles.",0.0,Neutro
L0rd_Muffin,2018-09-23,"I agree with you, but that’s why I also still go to warehouse parties also. Not everything has to be a $3,000 festival trip (although I do enjoy this from time to time) or a models and bottles club (which I despise). 

Sometimes a questionably legal, questionably safe warehouse with speakers and a DJ decks and likely illegal liquor sales is perfect. lol 

But no need to shit on the ppl who like the festival experience.",0.275,Positivo
treletraj,2017-03-11,“You kids get off my lawn!”,0.0,Neutro
almostDynamic,2025-02-12,Fireworks have always been a Tomorrowland thing - Ever since it started.,0.0,Neutro
RuBe94,2021-01-28,"Absolutely. The real electronic music culture died long ago when commercial interests realized how much money could be made.

We went to warehouses or clubs with some lasers and lights but the booth was dark. The only thing indicating who was playing at any given time, other than the set times list (which ended up being wrong half the time), was knowing the music or possibly getting close enough to see them behind the decks. It was all about the music / dancing with zero show. 

Now it's all about the show and ""look at me, look at me"" with perfect (fake) mixes synced to the lights, pyro and led screens. It's now pretty much exactly what we were trying to escape. Go figure.",0.012254901960784315,Positivo
sgt_science,2014-11-14,Tomorrowland is very much not new,0.09590909090909092,Positivo
Humledurr,2014-10-21,"Idk, Im been to several Rammstein concerts now, and their pyro-work is an amazing part of their concerts.",0.30000000000000004,Positivo
RhodyJim,2013-01-02,"""Real DJ"" LOL",1.0,Positivo
PatMyHolmes,2018-12-10,"""a real DJ"" Screw that! How bout live musicians?",0.19318181818181818,Positivo
