Usuario,Fecha_Creación,Comentario,Polaridad,Sentimiento
Evems,2015-01-01,"George RR Martin can't talk shit about LOST or any series ending until he ends his own series.  He arguably takes more time to write a single book than many authors today.  I honestly like how Lindelof even called him out on it after he heard Martin was bad talking LOST a lot during his press tour.

Lindelof twitter quote in response to Martin:

>“In related news, my therapist just hit the jackpot  … George? You got yourself a feud, motherf–ker … Winter IS coming, bitch … I don’t take issue with his opinion, I take issue with the fact that he coined “Pulling a LOST” as empirically “f–king up the ending” … I’ve just been informed George is working on his feud response. I’ll have it in FIVE YEARS! … Two final thoughts, George. A. They weren’t dead the whole time. B. 1997 called. It wants its web design back … I stand by the ending of the show and defend it accordingly. Until I am worthy of the New Yorker, this is the platform I’ve got.”

I'll admit Lindelof came off a bit dickish, but apparently Martin was bashing LOST a lot to the press, which is a dick thing to do as well when he hasn't even achieved an ending himself yet and is still purely riding his HBO wave.

Also, I really dislike it when people compare Breaking Bad, Game of Thrones ,or anything really, to LOST.  Breaking Bad was a simple, realistic character study show with a small cast.  It was perfection for what it intended to be and ended super simple like expected.  Game of Thrones is a fantasy epic with a large cast.  Pretty simple, but excellent.  LOST was on a whole other level of storytelling.  Metaphysics, sci-fi, multiple timelines, a large cast, mind-fuck mysteries and twists, multiple character developments, and a bunch more.  LOST took a lot of risks in its writing and that is why it's still a gold standard of serialized television today.",0.07121727478870336,Positivo
just_a_thought4U,,How much to be flown in by a cloud of singing butterflies?,0.2,Positivo
[eliminado],,Renting a house is the way to go. I took the family last summer and the house plus rental car came out quite a bit less than most hotel rooms would have. It's also convenient to not have to take a bus everywhere. Having a full size fridge makes it easier to buy food from a grocery store and not eat out as much. I'd go out of my way and say my most recent trip to Disney was easily $1000 less than any other trip I took there just because we rented a house.,0.1525,Positivo
TheWhiteeKnight,,Disney *Land*. Not Disney World. Disney World is *far* more expensive.,0.033333333333333326,Positivo
[eliminado],,"[deleted]  
 ^^^^^^^^^^^^^^^^0.3465 
 > [What is this?](https://pastebin.com/64GuVi2F/76577)",0.0,Neutro
[eliminado],,Both the emotion one and the dinosaur one are coming out this year.,0.0,Neutro
[eliminado],,And Toy Story 4.,0.0,Neutro
t3hlazy1,2012-09-16,And the one about Dia de los Muertos: http://pixar.wikia.com/Untitled_D%C3%ADa_de_los_Muertos_film,0.0,Neutro
mudbutt20,2012-11-15,I'm looking forward to inside out. Not really the last dinosaur.,-0.05,Negativo
[eliminado],,And there are comedic geniuses doing the voices.,0.0,Neutro
randomaccount178,2013-07-09,"Writing a mystery is easy, resolving a mystery is hard. Lost isn't on is own amazing level because it excelled at the easy stuff and sucked at the hard stuff. Asking a question is easy, answering it is hard, it is a series full of questions that doesn't have to live with its answers.",0.21113636363636362,Positivo
chipperpip,2012-08-10,"If that quote was supposed to get us on Lindelof's side, you failed pretty badly.  Now I think he's a bad writer *and* kind of an immature dick, whereas before I just thought of him as a bad writer.",-0.2916666666666666,Negativo
BZenMojo,2010-09-09,It failed its risks. It failed its multiple timelines and changed its mind at the last second. What could have been a savvy scifi ending was bullshit ass-pulling handwavium.,-0.2,Negativo
[eliminado],,"Ahaha I will never cease to be amazed at the fact that people can think that Lost is an example of awesome story telling when really, it's just a lazy one where the writers kept making shit up to move the plot forward.

As the guy below said, it's easy to make up mysteries, it's another thing to conclude such a story. And it is absolutely not the gold standard for anything outside of badly ending your show.",0.038333333333333344,Positivo
SnapHook,2011-08-22,That's part of the Princess package and cannot be purchased a la carte.,0.0,Neutro
devilinblue22,2011-08-17,5000 plus you leave one child to become genetically modified into the next Hannah Montana craze.,0.0,Neutro
atimholt,2010-09-18,"How does that work? Is it just an accelerated schedule this year, or is the dinosaur one akin to those “Plane” movies?",0.0,Neutro
Evems,2015-01-01,"True, answering can be hard.  But sometimes giving an unclear answer can be better than giving a clear, straight to the point one, in my opinion.  

LOST as a whole had a mysterious sense about it obviously and sometimes left a lot of the wondering up to the viewer which is what a lot of fans loved about it.  

To some, LOST had a bunch of ""unanswered"" questions, but many these of the questions were minor and actually answered, but these people were already stubborn LOST haters and weren't interested in hearing any logical explanations or thinking on their own.

Big questions like, ""What was the island really?"" were obviously not explained for the better in my opinion.  I liked how LOST left the island's all powerful mysteriousness intact.  A sort of mystical feel about it.  But on the other hand I can totally understand why it bugs some people.

I guess LOST will forever be known as having one of the most polarizing endings ever.",0.19197530864197532,Positivo
paperfisherman,2013-07-03,">excelled at the easy stuff 

You think developing a huge ensemble of characters, creating an entirely new groundbreaking way to tell stories in television, and crafting a serialized plot with 20+ episodes a year is the ""easy stuff""?  Man, you should really write for television.

>it is a series full of questions that doesn't have to live with its answers.

Lost actually *did* answer almost all of its mysteries, and wrapped up its mythology.

The thing is, the mysteries were slowly answered over the course of the entire show, as opposed to one, easy info dump/twist at the end, which is what most people were expecting.

In fact, some mysteries were answered so satisfactorily, that most people forget they were mysteries in the first place (What's in the hatch?  What crime did Kate commit?  How did Locke end up in a wheelchair?  Why are there polar bears on the Island?  Who was the French woman in the transmission?  Why doesn't Richard age?, etc, etc.)",0.21183712121212117,Positivo
[eliminado],,"Exactly, you have to be delusional to think otherwise.",0.25,Positivo
JarlaxleForPresident,2011-12-18,I hope someone does that soon. We need another sacrifice for the harvest.,0.0,Neutro
[eliminado],,"Nope, both Pixar. The Good Dinosaur was supposed to come out in 2014 but got bumped back to this fall (which is why they didn't release any movies last year).",0.2333333333333333,Positivo
Kytescall,2011-03-19,">In fact, some mysteries were answered so satisfactorily ...

I stopped following the show after season 2 when it became pretty obvious that they were just making it all up as they went along. I checked back in later to read up on the answers to the mysteries and it just seemed like a load of weak nonsense to me. 

I mean, you mentioned polar bears so I just looked that up. They were brought to the island because they had ""keen memory and adaptivity instincts""? Is that true about polar bears or did they make that up as a convenient way to explain their presence? Because there are a lot of other animals that are a lot easier to acquire and train that have those attributes. I would have gone with crows.

Here's what really happened: they introduced polar bears for the sake of making things weird. Easy mystery. Then they concocted some contrived explanation after the fact.

It's the way with every major mystery in Lost, so far as I can tell. They didn't come up with a scenario first and unveiled clues bit by bit. They came up with random clues first and then poorly tried to explain them or connect them together afterwards.

The most tantalizing mystery that stuck with me was one character's comment from the pilot episode - that the monster's noise was familiar, somehow. That's fascinating. Where would you have heard that, and what does that say about the nature and origin of the monster? Answer: Nothing whatsoever. The sound is familiar because they used the sound from a NY taxi cab cash machine in the sound design. It's just an incredibly cheap and lazy way to invoke an ""oooh, mystery"" reaction from the audience.

Such are the ""mysteries"" of Lost.",0.06979166666666665,Positivo
Random_Introvert_42,2022-07-07,"Belgian news say probably started by fireworks/pyrotechnics malfunctioning:  
[https://www.7sur7.be/belgique/la-scene-principale-de-tomorrowland-detruite-par-un-incendie\~aa5fc169/](https://www.7sur7.be/belgique/la-scene-principale-de-tomorrowland-detruite-par-un-incendie~aa5fc169/)",-0.75,Negativo
fake_cheese,2017-06-11,"Lets just be grateful that whatever caused this happened today instead of Saturday,",0.0,Neutro
h0zR,2015-11-17,Very humane of them to shoot it so it won't suffer burning to death.,0.2,Positivo
whiskeytab,2009-03-03,was\* starting friday,0.0,Neutro
M1dor1,2018-03-30,if i had a nickel everytime a tomorrowland mainstage burnt down i'd have 2 nickels which isn't a lot but it's weird it happened twice,-0.3277777777777778,Negativo
JohnClark13,2016-10-24,Leave the rubble. Invite some death metal bands. Have a good time.,0.7,Positivo
EpicallyLazyBoy,2025-03-27,Need to change the name to Never Never Land.,0.0,Neutro
wspnut,2010-05-28,there's a lot of hope going into that one nozzle,0.0,Neutro
SteamedGamer,2016-02-24,"Perform in the ashes. It's a more realistic ""Tomorrowland.""",0.3333333333333333,Positivo
LethalBacon,2012-10-21,"That's a lot of hard work destroyed.  I went to TomorrowWorld (American TomorrowLand) the year it crashed and burned due to inclement weather.  The stages there were absolutely amazing to see in action, and the ones at Tomorrowland are even better. 

Hopefully it doesn't completely collapse like Tomorrowworld did after 2015.  Hoping they're able to still have the festival, or at least recover for next year",0.10833333333333332,Positivo
tmstksbk,2018-01-23,"I mean at least it happened today, imagine this happening with thousands of people stampeding to get away. That wouldn't be fantastic.",-0.07083333333333335,Negativo
Fain196,2012-08-12,I live under a rock. What is Tommorrowland?,0.13636363636363635,Positivo
MysteryRadish,2016-11-05,"That's too bad, looks like it was an awesome stage design.  Heavy Dark Souls / Elden Ring vibes.",-0.012499999999999963,Negativo
JetScootr,2019-10-03,"We all came out to Montreux  
On the Lake Geneva shoreline  
To make records with a mobile  
We didn't have much time  
  
Frank Zappa and the mothers  
Were at the best place around  
But some stupid with a flare gun  
Burned the place to the ground

Smoke on the water

And fire in the sky

Smoke on the water",0.13333333333333333,Positivo
DamitKenneth,2014-11-17,"Pyro technically issues, hope they all got out safe.  Sets can be replaced. They had some type of insurance.",0.25,Positivo
death_by_chocolate,2012-04-06,"Thinking it might not start Friday, after all.",0.0,Neutro
elkoubi,2014-09-01,"Wendover literally just put out a video on the logistics of festivals and insurance for this kind of thing was a big part of it.

https://youtu.be/Om3IQ5HEQ8g?si=2-GZOPQhWLYD_WAG",0.3,Positivo
fuelvolts,2008-03-26,TIL Tomorrowland is a music festival. I literally thought Disney World was burning.,0.0,Neutro
kegelknievel666,2021-04-03,The Day after Tommorowland,0.0,Neutro
ChewyUbleck,2012-11-03,"I don’t know much about the festival, but it looks like the decorative structures were probably made with polystyrene core foam plastic. It’s extremely combustible and fires are nearly impossible to extinguish.",-0.1972222222222222,Negativo
djnehi,2019-06-28,"If this isn’t a fitting representation of the future, I don’t know what is.",0.25,Positivo
Phil_Coffins_666,2022-01-10,Clearly somebody played my latest mixtape for sound check. 🔥🔥,0.3333333333333333,Positivo
bws7037,2015-11-06,Damn I ope nobody got or gets hurt!,0.0,Neutro
NumerousResident1130,2021-01-30,"Retro 80's...The Roof, The Roof, The Roof is on FIRE!",0.0,Neutro
thismothafcka,2020-03-15,Can we all just enjoy the irony of it being a Snow covered theme.,0.4,Positivo
OkraEmergency361,2021-10-17,"I know what else to say, dear video commentator.  WHAT IDIOTS BUILT A STAGE FROM FLAMMABLE MATERIALS - *AGAIN?!*

How many more raging infernos at entertainment venues does it take before the world finally learns to use fireproof shit?",-0.04,Negativo
Occams_rusty_razor,2012-03-21,Stop trying to put it out.,0.0,Neutro
TheWanderingFaith13,2023-09-04,"Glad this happened, before any crowds were present.  Then we’d be looking at a possible mass casualty event.",0.16666666666666666,Positivo
Nervous-Ship3972,2021-01-22,"Looks like it was made out of something very flammable.  Luckily, it happened before everyone was there",0.26666666666666666,Positivo
Craic-Den,2024-03-06,"Tomorrowland generated €164 million last year, the owners must be absolutely livid in their palaces. Someone is getting fired.",0.1,Positivo
gangawalla,2012-03-03,Tomorrow it will be Yesterdayland!,0.0,Neutro
Princess_and_a_wench,2016-12-25,Curious if they used a fire retardant paint that’s frequently used in the film industry. But it’s pricey so it’s often skipped.,0.0,Neutro
Zaddyzn,2022-05-29,That hose is doing NOTHING,0.0,Neutro
play_destiny,2019-06-06,Damm what kind of lost is this ?  The equipment and speakers are toasted,0.6,Positivo
GeshtiannaSG,2015-06-04,Change the theme to post-apocalypse and just keep the damaged stuff.,0.0,Neutro
WatersEdge50,2022-03-14,What is tomorrowland? Never heard of it.,0.0,Neutro
Clean-Purple-6720,2024-10-25,This is not Disneyland that's good,0.7,Positivo
fikabonds,2021-07-26,Wtf did they use to make that stage? Shitnis flammable af,-0.5,Negativo
FreedomBread,2017-07-05,"""The fire is shooting at us!""  - Andy ""Nard Dog"" Bernard  

This is really heartbreaking to see - as a former carpenter for professional theater and productions, that is a tremendous amount of work that is just lost in minutes.",0.15833333333333333,Positivo
free_billstickers,2016-08-29,From tomorrowland to nevereverland,0.0,Neutro
sigmmakappa,2013-01-23,Fyre Festival 2025,0.0,Neutro
International_Bit_75,2020-10-15,"Today a festival, tomorrow land",0.0,Neutro
michaelbelgium,2015-06-12,Its sad. Millions of damage.,-0.5,Negativo
chileangod,2010-08-25,There's a global warming joke to be made here.,0.0,Neutro
BrilliantWrap2036,2020-10-11,Ahh... looks like the company that built Grenfell mansged to get themselves 1 more assignment.,0.5,Positivo
Ptown_Down,2011-08-09,Didn't this also happen in 2017?,0.0,Neutro
phoonie98,2013-04-19,The one stream of water like pissing in the wind,0.0,Neutro
SoggyWotsits,2019-06-21,I saw a post earlier where it was just a small fire. I hope everyone got out of the way safely.,0.08333333333333333,Positivo
Gurk_Vangus,2020-05-16,Song of ice and fire,0.0,Neutro
Kozmik_5,2019-06-05,Surrounding houses caught fire due to the fireworks as well...,-0.125,Negativo
Dutchwells,2019-03-17,I doubt it will start tomorrow,0.0,Neutro
Every_Tap8117,2021-07-08,refunds?,0.0,Neutro
MvatolokoS,2017-09-18,Tomorrowland because TODAY is already over!,0.0,Neutro
Gloomy_Industry8841,2022-01-28,I’m getting to hate pyrotechnics. Too many dangers.,-0.15000000000000002,Negativo
Katman666,2015-08-21,Tomorrowland has become Fyre Festival.,0.0,Neutro
Brainwashed_Voters,2025-03-22,"Two firetrucks on scene pumping into that yellow pump that had nozzles spraying the water just doesn't seem like the odds were in their favor for snuffing that out, even with a slight wind blowing right to left and towards the back of the scene we see.

If you are going to have pyrotechnics onsite, why not build the structure with something that doesn't burn itself down so rapidly?

I am not sure what they built the structure with, but that structure is half-engulfed already, and there are only two obvious fire trucks on scene, with others surely enroute, but they wouldn't make any difference in quenching the flames once they got there given how fast this structure is burning and how high the flames are. That's a very hot fire, and if there were other valuable structures behind what we see on screen that were in danger due to the wind blowing the flames in the direction the smoke is going, the best tactic would be to focus your water supply on saving any structures behind it from igniting. If nothing was behind it, sure you could throw all the water on what is burning (and not yet burning) all you want, but you aren't going to save anything of that structure, regardless of how many pumpers and hose lines you had connected to the cities water mains.

Not sure what the slight +/- 5 knot wind was blowing the fire towards behind what we see in this video but hopefully it wasn't other structures.

Reminds me of the Station Night Club Fire and how fast things can get out of hand with just a few pyrotechnics going off and igniting flammable materials with no properly engineered sprinkler system in place: [https://en.wikipedia.org/wiki/The\_Station\_nightclub\_fire](https://en.wikipedia.org/wiki/The_Station_nightclub_fire)",-0.008385331143951841,Negativo
GlassBug,2018-05-15,Hopefully they bought the Fyre Festival trademark,0.0,Neutro
DazzlingPoppie,2021-10-01,Should buff right out.,0.2857142857142857,Positivo
Mediocre-Toe3212,2020-10-08,Someone finally listened to my mixtape,0.0,Neutro
richardathome,2010-08-10,"""The festival’s brand-new theme ‘Orbyz’, set in a magical universe made entirely out of ice"" has burned down.

  
An Ice Park?  
  
Yeah.  
  
With the..

...the penguins, yes. 

Oh Ok.

An Ice Park?

Yeah.

Huh.

Yeah.

...

...

A FIRE?!

Yeah.. at the penguin show actually...",0.0763888888888889,Positivo
lumpy999,2014-08-28,Harrenhal,0.0,Neutro
btribble,2012-08-12,"Was

Was starting Friday.",0.0,Neutro
kcatmc2,2017-02-08,Am U the only one seeing the irony of the Tomorrowland stage in flames?,0.0,Neutro
SwugSteve,2013-03-12,terrible news for adults who dress like babies,-1.0,Negativo
lowkeylye,2013-04-17,Thought I was on Disney's subreddit and freaked out.,0.0,Neutro
GreenCactus223,2020-04-01,Do you think there will be a tomorrow for the venue?,0.0,Neutro
yoidles1,2013-12-22,I was wondering who would bought the rights to Fyre Fest,0.0,Neutro
thefragile7393,2014-12-28,Oh man :(,-0.75,Negativo
Forsaken-Inside-1010,2025-05-26,"Looks cool, what band is this ?",0.35,Positivo
Livy14,2020-04-23,I just saw a still photo of this like an hour or 2 ago. Huh so it got worst,-1.0,Negativo
Procrastanaseum,2010-09-29,That's really sad,-0.5,Negativo
CPTMotrin,2019-08-13,Not a lot of water being poured on it. It’s all at risk.,0.0,Neutro
grouzzly,2015-09-03,The show must go on.,0.0,Neutro
ckdickens,2018-02-12,Curious what the loss on that is…not counting the ticket holders backlash.,-0.1,Negativo
flyover_father,2017-08-18,The fire’s shooting at us,0.0,Neutro
won-an-art-contest,2019-08-19,“The fire is shooting at us” Andrew Bernard,0.0,Neutro
trollofzog,2010-10-31,Doubt it’s starting now,0.0,Neutro
bargu,2011-11-18,"""Let's cover a huge structure in highly flammable foam and them pack it up with fireworks, nothing can go wrong with that.""",0.01999999999999998,Positivo
AllWhiskeyNoHorse,2019-10-10,It turned from Tomorrowland to Neverland!,0.0,Neutro
stereotomyalan,2019-07-23,Tomorrow's show is over,0.0,Neutro
NotThatGuyAnother1,2019-03-08,Wow.  Just like the fire at that sea park.,0.1,Positivo
BigTexIsBig,2020-02-19,"Oh No!

Anyway..",0.0,Neutro
D-future_milli,2021-01-17,Welp !!! 🤷🏻‍♂️,0.0,Neutro
FogduckemonGo,2023-04-09,Now it's NEVERland festival,0.0,Neutro
WannPizzaMe,2022-03-20,Now it's Yesterdayland,0.0,Neutro
MrPlow_357,2018-08-13,"🎵🎵  Smoke on the water, Fire in the sky. 🎵🎵",0.0,Neutro
Schu3334,2022-09-04,Breaking News: Tomorrowland Festival has been renamed Fireland Festival.,0.0,Neutro
RasJamukha,2021-03-17,a song of ice and fire,0.0,Neutro
jrock2403,2020-12-30,tommorowland and burning man merged?,0.0,Neutro
IntentionalUndersite,2019-01-18,Looks like it’s not starting Friday,0.0,Neutro
personguy4440,2022-08-15,Accuracy 100,0.0,Neutro
Vaulters,2016-03-30,That's HOT,0.25,Positivo
JT8D-80,2020-10-29,Stage suicided because of the incoming shit music,-0.2,Negativo
DasFunktopus,2016-01-22,Not Tomorrow-Any-More-Land,0.0,Neutro
k33perStay3r64,2020-04-18,global warming stage,0.0,Neutro
MsAnnabel,2017-02-16,Is this Disneyland or Disney World or what?,0.0,Neutro
WeathervaneJesus1,2020-09-09,Maybe it should be called Fyre Festival,0.0,Neutro
barfbutler,2018-04-05,"With climate change, it really is mimicking tomorrow!",0.25,Positivo
PaulBradley,2012-12-19,Poetic,0.375,Positivo
Scooby-Dooby1,2019-11-20,😔,0.0,Neutro
Odd_Vampire,2017-03-05,I don't think it's starting Friday.,0.0,Neutro
Dynazty,2014-05-29,THE FIRE IS SHOOTING AT US,0.0,Neutro
StartingToLoveIMSA,2019-01-29,which WAS starting Friday,0.0,Neutro
zerofuksgiven27,2020-07-22,It was starring on Friday. :(,-0.75,Negativo
OSU1967,2018-11-29,Must be really catastrophic since this is posted on here twice.  About 30 minutes before this one..,0.2,Positivo
LonelyChannel3819,2021-09-17,More like Yesterdayville,0.5,Positivo
Tikkinger,2016-11-10,That tape was on fire yoooo,0.0,Neutro
bigfoot17,2007-03-30,Fyre Festival,0.0,Neutro
im_a_goat_factory,2015-10-17,More like nottomorrowland lol. Sucks,0.3333333333333333,Positivo
Frizeo,2014-09-19,TomorrowLand -> Burning Man 2.0 lets gooooo,0.0,Neutro
MikeyG916,2018-12-12,"Oh no.

Anyways.",0.0,Neutro
tomatoblade,2018-08-13,"What is tomorrowland? Don't answer, I don't care",0.0,Neutro
FickleCode2373,2021-08-10,jeeeeesus! imagine the stress on the promoters right now!,0.3571428571428571,Positivo
Gaelfling,2012-10-19,Good thing they tested them and it happened before crowds.,0.7,Positivo
DeepestWinterBlue,2018-01-15,Anyone know if there is Discover Belgium group chat I can join?,0.0,Neutro
redeemer404,2023-10-20,"It caught fire during a pyrotechnics test, so yeah this is why you test your stuff before you use it in front of thousands of spectators.",0.0,Neutro
traxxes,2012-02-29,"This, as someone who has attended Tomorrowland in past years, it would've been panic trampling/stampede chaos imo, it averages attendance of ~400k people from all over the world every year, mostly 20s-30s age. 

Potentially could've been a mass casualty event if it happened during a mainstage show, which is especially packed shoulder to shoulder for bigger DJs.

Edit: For just how packed mainstage can get, [visual reference](https://prismic-assets-cdn.tomorrowland.com/ZpuRzB5LeNNTxUe2_1721408511446_375aa05d-829f-4e24-a73b-0c3703afe802.jpg_0_5097239565175796623.jpg?crop=3643%2C2732%2C227%2C0&width=1440&height=1080) & [another angle from the left balcony](https://i0.wp.com/thegroovecartel.com/wp-content/uploads/2023/08/Tomorrowland-mainstage-2023.jpg?resize=1155%2C770&ssl=1), doesn't even show the mass of people who are packed up on the grass hill.",0.03571428571428571,Positivo
alison_bee,2011-08-30,For real! I can’t imagine how high the death and injury toll would have been if something like this happened during the actual festival…,0.1366666666666667,Positivo
dylanr92,2019-07-30,I’d be asking for a refund if I bought a ticket.,0.0,Neutro
nascarfan1234567,2017-09-18,I was gonna say this happened Saturday this would be a major tradgerg,0.0625,Positivo
ministerman,2015-02-19,The fire is shooting at us!,0.0,Neutro
BernieTheDachshund,2019-11-05,It really does sound like gunshots.,0.30000000000000004,Positivo
kiheihaole,2018-05-30,They just saw the black smoke and their instincts kicked in,-0.16666666666666666,Negativo
granoladeer,2019-08-05,It's actually an elaborate ad for Burning Man,0.5,Positivo
opossumlawyer_reer,2025-05-13,"The show must go on.... but now I'm curious to see if they pull out all the stops to make it work while insurance handles it, or if they cancel and refund.

I'm the type of guy to say ""we have 24 hours to slap a new stage together, Jimmy put a team together and get me whatever you can salvage, I'm gonna grab a van and go ~~steal~~ borrow shit""",-0.05454545454545456,Negativo
Hyper_Oats,2016-01-01,"There's 15 other stages, lmao. It's till happening.                
Just no main stage, which sucks because it's the biggest one.",0.02291666666666667,Positivo
ScipioAtTheGate,2018-06-19,"[Thought these festivals would be like a 1960's future technology show given the name, but it looks like they are more of a dance festival](https://youtu.be/JsfdFbIkuIU?t=19)",0.25,Positivo
noodle_attack,2015-01-19,"The festival went on, they borrowed a stage from Metallica",0.0,Neutro
AverageAntique3160,2021-03-01,You would have thought they would learn after the first time...,0.25,Positivo
MaiKulou,2024-12-25,The universe is trying to send us a message,0.0,Neutro
JohnClark13,2016-10-24,Call it: Raging in the Ashes of Tomorrowland,0.0,Neutro
Tystros,2016-09-16,playing metal without without electrical systems is tricky,0.0,Neutro
IEESEMAN_,2022-06-18,Next year land,0.0,Neutro
load_more_comets,2011-07-29,"Exit light, baby!",0.5,Positivo
