Usuario,Fecha_Creación,Comentario,Polaridad,Sentimiento
WiredOrange,2021-07-14,"Updated image

https://preview.redd.it/7uu7c85jcadf1.jpeg?width=1600&format=pjpg&auto=webp&s=8926f638fed3ffc7a09be096195759e650cbdb85",0.0,Neutro
Robitiate,2019-12-07,"Another clarification; this year's festival starts on Friday, July 18. Therefore, no participants there yet - so no audience injured.

Don't have any information about the 1000 employees working there though.

Edit: poor wording from me",-0.4,Negativo
Paws000,2020-04-04,Yesterdayland,0.0,Neutro
ElPuas2003,2019-12-05,"Just for clarification, this is Tomorrowland the *music festival*, not to be confused with the Tomorrowland of Disney fame",-0.4,Negativo
Barnagain,2018-04-07,Was there a firestarter? Maybe a twisted firestarter?,-0.5,Negativo
tthe_drake,2020-05-13,"The speed of information is amazing. Some people didn’t know about the Titanic sinking for weeks. Now we can see news in real time.

I hope no one was hurt at Tomorrowland.",0.4,Positivo
enkolainen,2016-08-19,I wonder how long time beforehand they order the set decorations.  Too bad it happened but it could have been worse. It could have happened when stage was live and area was full of people,-0.13272727272727275,Negativo
Nutsnboldt,2016-03-24,Rammstein just doing a warm up!,0.75,Positivo
Smart-Response9881,2025-03-31,There is a metaphor here...,0.0,Neutro
RetroCogs,2023-10-12,"""A fire!?!?? At SeaParks"" !?!??",0.0,Neutro
314flavoredpie,2022-03-03,https://preview.redd.it/hxqggt8ebadf1.jpeg?width=750&format=pjpg&auto=webp&s=58adde362aa14c4d519e2f683eb63f7435cf3644,0.0,Neutro
Local-Car-5230,2022-04-28,"Ah, you mean literal fire",-0.3125,Negativo
kulungo,2020-10-20,Fyre festival comeback!,0.0,Neutro
zestypov,2021-06-17,"A.G. Bondi - ""We planned to read the Epstein file on stage at Tomorrowland, but unfortunately, the file was destroyed by a totally unplanned fire which was likely started by the Biden Crime family.  An investigation is underway.""",-0.16666666666666666,Negativo
Studiolx-au,2024-04-02,My thoughts are with the production crew & the lighting hire company. Such an awful thing to happen. That’s a hell of a lot of kit destroyed.,-0.5,Negativo
pewpewpew9191,2022-01-07,Burning man but different,0.0,Neutro
Panpancanstand,2025-01-12,How apropos for our time.,0.0,Neutro
CnCorange,2018-02-08,This thing escalated fast. Only an hour ago it was just one of the stages had a small fire. So much for that festival coming up,0.037500000000000006,Positivo
KrownX,2018-07-11,Only needs some guy in it and it's Burning Man,0.0,Neutro
sivah_168,2022-04-03,Tomorrow to yesterday.,0.0,Neutro
cms5213,2017-04-18,Now that’s a Fyre fest,0.0,Neutro
Commercial-Fennel219,2024-04-03,The name is accurate then,0.4000000000000001,Positivo
Designer-Bid-3155,2020-08-24,The massive amount of pyrotechnics on and around that stage......,0.0,Neutro
RaisinDetre,2014-11-29,at least we know about it ahead of time so we can do something to prevent it.,-0.3,Negativo
djmd808,2016-03-18,That's gonna leave a mark,0.0,Neutro
shoulda-known-better,2020-10-18,So glad this was before the festival.... Hope everyone is safe,0.5,Positivo
Mindless_Welcome3302,2021-01-29,Everything is on fire these days,0.0,Neutro
MathIsHard_11236,2022-01-26,"Given the state of...well, everything...this is as apt a representation of Tomorrow as one can expect.",0.6,Positivo
user328i,2019-07-23,Seems like an appropriate depiction of tomorrow.,0.5,Positivo
Normal_Tour6998,2022-08-05,"Here today, gone Tomorrowland.",0.0,Neutro
audioproof,2014-01-14,What a metaphor of our times,0.0,Neutro
Tactical_Tubesock,2023-03-29,That stage is fire!🔥,0.0,Neutro
cursedcalamari,2020-11-13,"So it’s Neverland now?

Edit: thanks for the award, that’s a first!",0.25625,Positivo
BadDaditude,2018-01-01,"This is terrible, and I'm glad it didn't happen when the festival was in full swing. Things can be replaced, people cannot (yet).",-0.05000000000000001,Negativo
RedRedVVine,2020-04-23,Oh ffs I thought this was Disney lmfao,0.0,Neutro
MongolianCluster,2016-05-16,Burning Man already has that schtick.,0.0,Neutro
scr0tal,2013-02-01,All we need is excision dropping a banger while the stage burns,0.0,Neutro
Salty_Morsel69,2024-02-11,Symbolic af,0.0,Neutro
Major_Yogurt6595,2024-04-30,Thank god this happened before the festival started.,0.0,Neutro
International_Bit_75,2020-10-15,"Today a festival, tomorrow land",0.0,Neutro
AvocadosaredankAF,2025-06-07,They’re rebranding to Fyre Festival,0.0,Neutro
DerpDerpingtov,2018-11-28,Now it is a Nextyearland,0.0,Neutro
FirstManufacturer648,2023-11-18,It’s definitely more accurate now.,0.45000000000000007,Positivo
Sirneko,2010-12-19,Every festival wants to be Burning man,0.2,Positivo
unsolved49,2020-07-16,Tomorrowland is lit,0.0,Neutro
HisCromulency,2021-07-02,If only there was a way to capture the horizontal scene in the frame without having to pan left and right. Someday we’ll have the technology.,0.09523809523809523,Positivo
Existing-Mulberry382,2023-07-30,Glad that I knew it today.,0.5,Positivo
unclefire,2012-10-01,Better now before the festival starts.   Frankly I wouldn’t have fireworks or whatever with a stage that big and flammable.   They’re screwed for this year.,0.25,Positivo
amanam0ngb0ts,2024-11-13,Yesterdayland,0.0,Neutro
Trespassa,2016-10-14,"“Any piece of gear can become a smoke machine if you abuse it enough.”
Glad no-one got hurt.
Curious at what the cause could have been.",0.13333333333333333,Positivo
Humprdink,2023-03-07,a sad but fitting metaphor given our political climate,0.0,Neutro
Botol-Cebok,2018-07-02,"And just like that, Tomorrowland became a Rammstein gig.",0.0,Neutro
bengalsfan2442,2025-01-23,Neverland,0.0,Neutro
Vegetable_Read_1389,2023-11-17,https://preview.redd.it/647wrx6cladf1.jpeg?width=1024&format=pjpg&auto=webp&s=fa2c153f3bbb970db7d8981b59e70bc9ec74a878,0.0,Neutro
Hot-Comfort8839,2025-02-05,"r/killthecameraman

Was it so hard for them to turn the phone 90 degrees and get the whole thing into the frame at the same time?",-0.030555555555555558,Negativo
cheetaratops,2012-06-27,Could not ever conceive of a better metaphor for life right now than this,0.39285714285714285,Positivo
Toadally420,2011-11-01,Firefest,0.0,Neutro
joostiphone,2013-12-27,Tomorrowland becomes Neverland.,0.0,Neutro
Horrison2,2021-06-22,So they're updating to show a more accurate future?,0.30000000000000004,Positivo
Aarkanis,2024-08-09,Now it's Yesterdayland,0.0,Neutro
numinosaur,2022-04-11,It's really weird that a place where they are supposedly testing pyrotechnics before a giant wooden decorum does not have fire services standby on site.,-0.16666666666666666,Negativo
Davidavid89,2015-01-24,I hope the drugs are okay,0.5,Positivo
monochrome83,2013-10-25,"I saw they posted a statement, didn't realize it was THAT bad. I think they said no one got hurt, thank God.",-0.6999999999999998,Negativo
LuluLemon_711,2023-10-09,MaybeNextYearLand,0.0,Neutro
rememberaj,2018-04-20,Better during the rehearsal than at the event though,0.5,Positivo
USSophist,2023-08-15,"It feels like this is a metaphor for the world, right now.",0.2857142857142857,Positivo
nando_88m,2012-12-28,Burning Land,0.0,Neutro
inboomer,2024-09-18,The roof is on fire!,0.0,Neutro
theburmeseguy,2019-06-16,There is no tomorrow,0.0,Neutro
Boob_Light,2019-01-12,So sad. They make the most unbelievable sets of all music festivals. True artwork destroyed,0.024999999999999994,Positivo
-Cheezus_H_Rice-,2019-09-12,"Festival today, tomorrow land.",0.0,Neutro
Deadfro6,2018-12-09,That opening set was “lit.”,0.0,Neutro
Mission_Estate_6384,2022-06-30,Is that possible since it hasn't happened yet?,0.0,Neutro
NDN0311,2025-02-19,Tomorrow is never promised.,0.0,Neutro
HereForSuperStonk,2023-06-16,![gif](giphy|9DgqJqtBXtIPonBMUP),0.0,Neutro
ToastyBytes,2017-11-15,foreshadowing,0.0,Neutro
IDEK7769,2024-09-07,More like neverland. Ha am i right gang???,0.39285714285714285,Positivo
TheJneeR,2015-07-28,Refund button ----≥,0.0,Neutro
medikundi,2021-10-24,Dracarys,0.0,Neutro
AmishSloth84,2020-09-07,Ha! We have no future,0.0,Neutro
Tan_Iobia,2025-07-06,The new Fyre Festival,0.13636363636363635,Positivo
fubarthing,2017-04-02,A new Netflix title is coming in like: Trainwreck: Tomorrow land to burning man,0.13636363636363635,Positivo
Stuffed_deffuts,2022-02-17,Kinda looks like yesterdayland now,0.0,Neutro
dramatic-sans,2021-07-11,Tomorrow it'll be yesterdayland,0.0,Neutro
Beginning_Sea6458,2021-03-03,At least we've got a 24hr warning that this is going to happen.,-0.3,Negativo
TheyCallHimBabaYagaa,2024-03-13,It burnt like there was no Tomorrow,0.0,Neutro
OldBlackRum,2025-04-28,Will it still be there tomorrow?,0.0,Neutro
kwizzerz,2020-12-05,Yesterdayland now.,0.0,Neutro
Reasonable_Day_9300,2021-02-11,Tomorrowasteland?,0.0,Neutro
Apprehensive_Room742,2023-08-13,"well, at least this happened at tomorrowland and not a good festival",-0.32499999999999996,Negativo
maobezw,2014-07-18,"""tomorrowland is on fire"" - couldnt say it better seeing the actual state of the world and its impact on our future...",0.16666666666666666,Positivo
Hubsimaus,2018-05-18,"As much as that sucks they can be happy it happened BEFORE the festival started. Imagine having a fire break out while thousands of people are there.

Remember the end of the Love Parade in Duisburg? We don't need another mass panic that costs lots of lives.",0.19000000000000003,Positivo
rekcuzfpok,2018-07-15,This years' setup really is on fire,0.2,Positivo
memeatic_ape,2019-10-01,"Burn it to the ground

Linkin Park",0.0,Neutro
Blightyear55,2018-03-28,Day After Tomorrowland?,0.0,Neutro
Taiphoon228,2021-02-24,"Tomorrow it will just be tomorrow, a piece of land.",0.0,Neutro
DIRERone,2024-08-16,Tomorrowland is clearly not made for today!,-0.06249999999999999,Negativo
Barraxx,2015-11-22,Finally a tomorrowland show you can see even if you stand in the back,0.0,Neutro
TehEpicBeast,2013-04-04,"Wait a minute, this isn’t burning man festival",0.0,Neutro
Working_Historian970,2022-02-21,Nomorrowland,0.0,Neutro
ThrowRAavila,2021-09-08,"this is so sad but honestly better to catch on fire during tests than causing a mass emergency exodus from the stage while the festival is running

my heat hurts for the people who spent months, if not years, putting this stage together though. 😔",-0.03333333333333333,Negativo
[eliminado],,"If there was only some kind of way to get a wide shot. Maybe they can make a phone that’s wider than it is taller. No wait, that’s crazy talk what am I saying.

We just aren’t there yet. Maybe AI can help.",-0.024999999999999994,Negativo
ImKibitz,2016-01-10,Now it's Neverland,0.0,Neutro
SubbyGentleman,2025-06-30,"Tomorrowland is a large-scale annual electronic dance music festival held in Boom, Antwerp, Belgium. Taking place within De Schorre provincial recreational park, it held its first edition in 2005, from an idea conceived by brothers Manu and Michiel Beers in 2004. Since then, Tomorrowland has become one of the best known music festivals in the world. It has won numerous accolades and awards, including being voted five times in a row as ""best musical event of the year"" at the International Dance Music Awards.",0.375,Positivo
Hot_patsy_52,2024-01-20,"This is so sad to
See for everyone that built it designed it the artists and the loyal fans who have dreamed about Tomorrowland  Martin will do something he just won’t appear",-0.08333333333333334,Negativo
tjohnson4,2015-05-27,Quicker than a traditional teardown,0.0,Neutro
Familiar_Text_6913,2023-03-10,The event is this weekend. Theres updates on their website.,0.0,Neutro
cidthekid07,2017-06-09,It’s yesterland now,0.0,Neutro
Whatwhatwhatwhatnani,2020-12-20,Tomorrowland ist abgebrannt,0.0,Neutro
Chuggs400,2012-08-07,That looks expensive,-0.5,Negativo
salazka,2019-06-21,Awwwww no... :(,-0.75,Negativo
ChooChooBananaTrain,2024-08-15,Ryan started the fire!,0.0,Neutro
Current-Ideal-697,2020-12-10,Rammstein playing?,0.0,Neutro
dlc741,2018-07-10,Is this the new FyreFestival?,0.13636363636363635,Positivo
DLoBass,2023-02-11,Oh shit,-0.2,Negativo
Adventurous-Sky9359,2023-11-05,Hats tomorrow land?,0.0,Neutro
Cduke3829,2015-09-21,Never seen a fireworks finally in the beginning. They thought of everything!,0.0,Neutro
robustofilth,2024-06-13,That’s a big fire,0.0,Neutro
stupidracist,2024-03-15,Looks more like Mustafar.,0.5,Positivo
AdmiralClover,2020-06-05,Wonder how the insurance company is gonna avoid paying out for that one,0.0,Neutro
Vivalo,2014-02-10,"Tomorrowlands location is epic. I was there a few years ago in the daytime (just visiting the park with the kids). 

It was all setup and going to kick off the following day.",-0.03333333333333333,Negativo
Simons_fede,2016-08-02,NoTomorrowLand,0.0,Neutro
GoatTheNewb,2018-02-15,Looks more like Fyre Festival..,0.5,Positivo
Empty_Positive,2020-01-24,"Not today land, badum tssss",0.0,Neutro
Deez_88,2022-10-17,Such a reminder of where our society is going…,0.0,Neutro
surfinbird,2009-06-29,![gif](giphy|QMHoU66sBXqqLqYvGO),0.0,Neutro
DLIVERATOR,2020-04-20,"And just like that, Tomorrowland became Yesterdayland.",0.0,Neutro
WilliamTee,2018-01-04,So... accurate portrayal of the future then?,0.20000000000000004,Positivo
drcrunknasty,2011-09-08,"Tomorrowland, seeking Waterworld",0.0,Neutro
Crispyratfoot,2022-02-21,It’s just the main stage and the festival will go ahead .  Got a friend travelling there at the moment,0.16666666666666666,Positivo
teapotboy,2018-08-15,Party like there’s no tomorrow!,0.0,Neutro
Neat_Confection_6510,2025-05-11,Did they have the winning bid on eBay for Fyre Fest?,0.5,Positivo
bifuriousroxy,2021-01-21,"Interesting that Bonnaroo gets shut down for flooding and now we have Tomorrowland burning, is this the music festival version of the 7 plagues of Egypt?",0.17222222222222222,Positivo
RealTexMex,2016-02-25,It’s accurate to how I think our future will look like,0.20000000000000004,Positivo
strongofheart69,2020-10-30,"Never had fireworks before a festival, always after!",0.0,Neutro
skalfyfan,2015-02-12,Is this the FYRE Festival sequel on Netflix? Except this time it's on land instead of an island?,0.0,Neutro
Rach_,2013-03-08,Same thing happened in Barcelona 2017. [Barcelona Tomorrowland](https://www.theguardian.com/world/2017/jul/30/more-22000-evacuated-as-fire-hits-spain-music-festival),0.0,Neutro
HecticHermes,2017-12-05,The future is on fire. It's fine. It's fine,0.2777777777777778,Positivo
Best-Database-9962,2022-06-11,It seems like everything is up in flames lately. What is the world coming down?,-0.22777777777777777,Negativo
A_Unqiue_Username,2017-04-19,Rather prophetic.,0.0,Neutro
Lost_Found84,2021-02-05,Todayland ain’t doing so hot either.,0.25,Positivo
Salty_QC,2024-07-13,"I’m just glad todayland is not on fire. I’ll deal with Tomorrowland, tomorrow.",0.5,Positivo
Jenkendz,2021-02-03,Im on a lunch break for a class on Electrical Work for live events and I see this. I wonder what the cause was.,0.13636363636363635,Positivo
Mayjune811,2020-07-11,"Either way, the future on fire is pretty fucking accurate tbh.",0.2166666666666667,Positivo
Sedition_Vision,2020-12-29,Yesterdayland,0.0,Neutro
AnalphabeticPenguin,2023-11-15,Where is it?,0.0,Neutro
Hairyponch0,2016-04-28,Deal with it tomorrow,0.0,Neutro
ffoxonfire,2019-03-21,"global warming is real.  
the land of tomorrow will be a giant bonfire.",0.06666666666666667,Positivo
TheVoicesSpeakToMe,2023-06-05,"If anyone attempted to play on that stage while it was on fire, they would be legends.",0.0,Neutro
4-Inch-Butthole-Club,2025-05-30,Bet they didn’t see that coming.,0.0,Neutro
SnooHobbies8197,2020-10-06,But where is it?,0.0,Neutro
Fillmore80,2019-07-01,This is how they cash in on insurance and then rebuild somthing else......,0.0,Neutro
silliusmaximusIV,2019-12-09,"Honestly gutted for anyone with a ticket. Whether you like the music or not I’d be so upset if something big happened to Glastonbury a few days out when I had a ticket. 

But assuming it all goes ahead as normal I guarantee you the people who go this year will end up having one of the best years yet in smaller tents chatting shit to every Tom dick and Harry which is what’s it all about lol",0.26875,Positivo
mbstone,2016-11-19,"Holy, not like a little on fire but almost completed engulfed fire.",-0.1875,Negativo
Notablyshallow,2017-03-11,Good thing it wasn’t during the event. Who approved that build?,0.7,Positivo
woke-2-broke,2024-10-03,"to be fair, it’s an accurate depiction of what will become of our land (Earth), Tomorrow",0.55,Positivo
GooglyMoogly122,2015-05-13,Is this foreshadowing for the future?,0.0,Neutro
ApatheistHeretic,2019-01-12,Downgraded to 'No-tomorrowland',0.0,Neutro
Upstairs-Bad-3576,2023-08-16,Tomorrowland is so yesterday,0.0,Neutro
xamountain,2023-04-18,And now it's called Yesterdayland!,0.0,Neutro
ChloeDavide,2023-12-25,I guess it won't be there tomorrow.,0.0,Neutro
Acrobatic_Code_7409,2023-10-01,More like Neverland now,0.5,Positivo
nanomistake,2018-12-11,"For clarification “we didn’t start the fire, it was always burning…”",0.0,Neutro
Knoetsch,2016-04-01,Great metaphor.,0.8,Positivo
Blubearz,2017-04-26,"When I read the title, I expected to see a big concert with a bunch of people and lights and fireworks… 
But no, yeah that really is literally “on fire” lol. Well shit 🤷‍♂️",0.13999999999999999,Positivo
greggers1980,2024-07-01,Insurance claim,0.0,Neutro
NYC2BUR,2023-02-01,"# Tomorrowland 2025 Mainstage Destroyed by Fire Ahead of Festival

[The Belgian dance mega-festival is scheduled to start on July 18.](https://www.billboard.com/music/music-news/tomorrowland-2025-mainstage-fire-destroyed-1236022907/)",0.0,Neutro
Trollsama,2015-01-27,"I feel like there is an underlying climate change message buried in the imagery of a raging fire at ""tomorrowland"" lol",0.8,Positivo
NYC_Traveler_,2021-01-31,Does that make it Yesterdayland?,0.0,Neutro
Bhutros1,2020-10-28,Lot of sad ravers today. I am not one of them.,-0.5,Negativo
Deansies,2018-04-11,Is this Fyre fest 2?,0.0,Neutro
iFrizz,2019-07-09,These DJs were fire..,0.0,Neutro
Mfsmitty,2014-03-23,Deep Thoughts by Jack Handey,0.0,Neutro
AlteOtsu,2021-01-01,Tomorrowland is fire!,0.0,Neutro
Fractal_Strike,2012-04-04,"The more I see this the more I think they dodged a huge bullet here. If there were any pyrotechnics during a live show and this happened someone would have died. It hugely sucks for everyone involved, but building something out of gasoline has its drawbacks.",0.24727272727272723,Positivo
YoungDiscord,2017-10-20,"I guess its about to become...

![gif](giphy|JhJYK9TnxAbTO)

*yesterdayland*",0.0,Neutro
Chuntttttt69,2020-12-09,Looks like a problem for tomorrow.,0.0,Neutro
kevprice83,2017-06-16,Just became neverland!,0.0,Neutro
Ok_Zombie_8354,2023-10-23,There is no Tomorrow,0.0,Neutro
Dear-Somewhere-3468,2022-12-01,It’s Yesterdayland now,0.0,Neutro
Definitely_obvious,2016-11-29,Well… there’s always tomorrow,0.0,Neutro
DrVagax,2012-04-17,"Damn that sucks a lot, their stage setup is literally among the best on the planet",0.35,Positivo
BattleSlow5192,2024-04-06,That land won't be there tomorrow,0.0,Neutro
Fortnait739595958,2018-04-02,Didn't knew Rammstein was playing there,0.0,Neutro
Necessary_Adagio_516,2024-04-26,Tomorrow land is gonna have to open the day after tomorrow.,0.0,Neutro
violinha,2008-06-17,I read the title and at first I thought it was metaphorically…,0.25,Positivo
MuscaMurum,2020-08-28,Some context would have been nice...,0.6,Positivo
evofromk0,2024-04-27,This is how Tomorrowland goes to Burning Man festival. Transition period.,0.0,Neutro
[eliminado],,That looks expensive,-0.5,Negativo
olekim,2019-02-04,zo'n grote vuurbal jonguh,0.0,Neutro
Mysterious-Ocelot191,2021-02-26,Oh no,0.0,Neutro
EccentricSoaper,2020-07-03,Why did i get a notification for this?,0.0,Neutro
No-Chance1789,2023-05-28,Oh my god this is horrible 😭they work so hard every year on this stage,-0.6458333333333334,Negativo
Igotdaruns,2016-12-29,This is what happens when your whole stage is epoxy coated styrofoam.,0.2,Positivo
harrymurkin,2016-02-14,shoutout to op for portrait panning rather than landscape still,0.0,Neutro
Cohliers,2016-03-13,"Chat, is this foreshadowing?",0.0,Neutro
Ultidon,2019-05-05,Someone’s fired for sure,0.5,Positivo
tvguy222,2016-12-31,"At the risk of sounding stupid, what is Tomorrowland?",-0.7999999999999999,Negativo
DuckSoprano,2019-09-30,That's lit,0.0,Neutro
HUGEshanus842,2024-09-16,Why can't that happen to my work?,0.0,Neutro
Objective-Ring7630,2024-07-26,In 2 days tomorrow would be yesterday.,0.0,Neutro
IHAVE2POO,2016-08-29,Event organizers lost too much money and needed that insurance check.,0.2,Positivo
fancybaboon,2017-11-12,Tomorrowland became Neverland?,0.0,Neutro
Turbo_Man123,,Dang so fyre festival did happen?,0.0,Neutro
broccollimonster,2017-06-28,Why does this feel like a metaphorical early-premonition?,0.0,Neutro
ray058,2021-01-28,There is always nextyearland,0.0,Neutro
sound_scientist,2020-04-10,Stop letting children with no experience produce your events,0.0,Neutro
Choice-Presence8386,2022-06-11,Looks like Toasted Land now,0.0,Neutro
kaowser,2013-11-14,area 51 also on fire,0.0,Neutro
Scottnothot12,2022-03-24,The real Fyre Festival,0.2,Positivo
SGTShizzle,2022-08-03,“The fire is shooting at us!”,0.0,Neutro
GerryC,2015-01-08,She's looking a bit crispy boss.,0.0,Neutro
brayjr,2014-12-02,"Honestly, if it was only set pieces that burned and the metal structure is still there, and they can deem it safe, they should do the concert still. Has a kinda sick theme to it now.",0.09642857142857145,Positivo
d_zeen,2022-07-09,Honestly it looks awesome like that I wish they could roll with it as is but obviously would not be safe all the structural components would be weakened because of the fire.,0.525,Positivo
Meister1412,2018-05-08,It's already confirmed that nobody was injured,0.4,Positivo
OppositeDue,2020-07-02,I dont think they will be ready in time,0.2,Positivo
TheTerribleInvestor,2020-03-09,Damn that sucks. Tomorrowland is a huge event a lot of people travel for.,0.04999999999999999,Positivo
Harry_Fucking_Seldon,2023-08-15,Ugh I feel so bad for the production team,-0.6999999999999998,Negativo
phlooo,2014-10-24,"> this year's festival starts on Friday, July 18

Wellll probably not",0.0,Neutro
spasmoidic,2022-11-27,"\* was supposed to start

Not sure if they can still do a music festival without the stage and sound system",0.07500000000000001,Positivo
SpaceToaster,2010-07-28,Thank God it wasn’t Todayland,0.0,Neutro
Gumbaya69,2024-01-10,YO thats tomorrow! Tomorrowland is supposed to start Tomorrow!,0.0,Neutro
Glimmer_III,2017-09-04,"> _so no one injured._

So no [audience] injured.

There are going to be so many technicians getting this set-up. However, yes, the current word is no one was injured, techs, audience, or otherwise.

Let's hope it stays that way.",0.25,Positivo
CreativeFedora,2018-02-08,Fyre Fest.,0.0,Neutro
71degahole,2020-09-07,Ashland,0.0,Neutro
distractionfactory,2014-06-24,"IDK, seems like pretty believable foreshadowing considering the last few years.",0.1375,Positivo
shunkplunk,2016-11-16,All my troubles seemed so far awayland,0.1,Positivo
bellybuttonbidet,2025-03-26,Toosoonland,0.0,Neutro
Screwdriving_Hammer,2022-09-28,Two-days-before-the-day-after-tomorrow land.,0.0,Neutro
GlitchKraftTv,2023-03-11,"For those still confused, Tomorrowland is a huge festival in Belgium (Europe). 

'A huge fire has consumed the main stage of Belgium’s world-famous Tomorrowland festival, days ahead of its planned opening on Friday.

“Due to a serious incident and fire on the Tomorrowland Mainstage, our beloved Mainstage has been severely damaged,” festival organizers said in a statement Wednesday evening.

“We can confirm that no one was injured during the incident.”'

Here's more info: https://edition.cnn.com/2025/07/16/europe/tomorrowland-festival-belgium-fire-intl-latam

Edited to add: apparently Tomorrowland is not that ""world-famous"" since a lot of people have never heard of it. 😅",0.1509259259259259,Positivo
gemstun,2018-11-25,"Oh good, I can still use the E ticket I’ve been saving then

Edit: I’m a bit amazed that this post has so far gotten over 1000 likes. I thought hardly anybody would even know what an E-ticket is anymore!",0.14513888888888885,Positivo
cyrus709,2019-02-15,"Thanks I thought it was Michael Jackson’s place, so was still wrong.",-0.15,Negativo
donadd,2013-12-25,Is George Clooney okay?,0.5,Positivo
Canonconstructor,2016-12-01,I was so confused.  Thank you for clarifying,-0.4,Negativo
rojo7777,2015-04-02,I didnt know Disney had a Tomorrowland only knew of the music festival,0.0,Neutro
WeAreAllMadHere218,2020-03-31,"Good grief, I was thinking this looks nothing like Tomorrowland at Disneyland 🧐",-0.050000000000000044,Negativo
tkaczyk1991,2014-07-27,![gif](giphy|l3fZAo5n5n0IghqO4),0.0,Neutro
Playful1039,2025-04-19,This is the third post I've seen about this and the first where anyone's clarified. Thank you,0.125,Positivo
DexM23,2017-02-03,TIL there is also a Disney thing called Tomorrowland,0.0,Neutro
chickles88,2018-11-28,"I.e this is the better Tomorrowland, sadly",0.0,Neutro
kannitt0,2016-08-28,"Wait a minute, Is there a Tomorrowland of Disney?",0.0,Neutro
pedrojgim,2017-11-22,https://preview.redd.it/qj23f3pf8adf1.jpeg?width=500&format=pjpg&auto=webp&s=9d88f044eced76e77f4c9a35c7dfe867240eee71,0.0,Neutro
pandersaurus,2018-03-20,https://preview.redd.it/k7c1msgtdadf1.jpeg?width=3024&format=pjpg&auto=webp&s=6d35cc07b095a66692dfef59f4934dfd64dbbb2f,0.0,Neutro
Agentpurple013,2021-01-28,![gif](giphy|7krK2aL5IEUTK),0.0,Neutro
bassman314,2019-10-28,That’s a pound in the pun jar in his pub!,0.0,Neutro
